Group,Review
G3,"
Es ist gut gemacht das zum start des videos erst einmal das problem dargestellt wird was dieses produkt lösen möchte. Damit wird die Zielgruppe direkt angesprochen
dannach wird einem auf simpele art und weise erklärt wie man die App benutzt was die benutzerfreundlichkeit zeigt
darauf folgend sieht man das die App eine allround lösung für ski strips sind, von transport bis zu hotel und skianlage ist alles auf einem platz buchbar.
zum ende der präsentation sieht man die nähere erklärung des geschäfftsmodels. An dieser erklärenden grafik kann man erkennen das dass geschäftsmodell der App im kerne Vermittlung ist. und dort beginnt auch die Kritik an dem Produkt.    
Das Produkt bring keine grundlegende neue funktion das geschäftsmodell basiert auf andere anbieter was unsere verhandlungsmacht in der branche drastisch senkt.
In der Präsentation wird nicht auf den finanziellen Aspekt der Firma eingegangen. wie ist der cashflow? wie hoch sind die operating costs? Grundlegende fragen wurden nicht beantwortet.
In der Präsentation wird die UI von der App nicht vorgestellt. Die einfache Funktion Gruppen zu erstellen wurde im Video vorgestellt, aber wie sieht das ganze dann wirklich in der App aus? Ist es genau so Benutzerfreundlich wie in der Präsentation? 
Wie lange ist die App in Entwicklung und wurde die App schon auf beliebigen Märkten getestet, sind zwei Fragen die in der Präsentation auch angesprochen werden mussten. Die App zeigt keine Erfahrung und Testläufe, was den Investoren keine Sicherheit gibt.  
Wurde die App schon gefundet? Wie steht die Firma in diesem Monat finanziell da. Das sind Essenzielle Informationen die geboten werden müssen in einer Pitch Präsentation.  
Wie viele Benutzer hat die App zurzeit ist ein wichtiger Faktor der in einem Pitch für eine App angesprochen werden sollte. Wie viele Aktive Benutzer hat die App? Die Co Founder sollten mehr darauf eingehen. 
Das Video war nur ein Voice layover. Ein Video in Person mit Gestikulationen könnte überzeugender sein.







 


  







"
G3,"""Alp-Us"" ist ein Tool, das das Bergerlebnis angenehmer machen soll. Es gibt zahlreiche Funktionen, die es Benutzern, die diese Anwendung verwenden, ermoglichen, Ausfluge in die Berge zu organisieren, Wintersport zu betreiben und all dies zu tun, ohne in stressige oder demotivierende Situationen zu geraten. Aus unserer taglichen Erfahrung wissen wir, wie schwierig und stressig die Organisation einer Reise sein kann. ""Alp-Us"" hilft den Benutzern und erleichtert ihnen die Organisation. ""Alp-Us"" ist ein Tool, das fur Familiengruppen, Unternehmen und Freundeskreise gleichermaben nutzlich sein kann. Diese App verfugt uber ein Zentralisierungssystem, das es einem ""Leiter"" ermoglicht, interessierte Benutzer durch das Senden geeigneter Links zur Nutzung einzuladen. Dieses System vergindert, dass das Erlebnis zu ablenkend wird (was sicherlich die Qualitat des Dienstes verbessert). Um das Erlebnis noch authentischer zu gestalten, bietet ""Alp-Us"" auberdem die Moglichkeit, das Erlebnis bereits bei der Registrierung individuell zu gestalten. Tatsachlich werden wir gefragt, welche Praferenzen wir hinsichtlich der Mobilitatsmoglichkeit en oder der Verfugbarkeit von Skigebieten haben. Basierend auf den Informationen, die der Benutzer bei der Registrierung eingibt, erstellt ""Alp-Us"" Pakete, die den Bedurfnissen derjenigen entsprechen, die die Anwendung nutzen. Dieses Paket umfasst beispielsweise Einkehrmoglichkeiten, mogliche Unterkunfte und schlagt auch Transportlosungen vor, die den Angaben des Nutzers entsprechen. Eine sekundare Funktion der Personalisierung des Erlebnisses und der Erstellung dieser personalisierten Pakete besteht darin, dass die Anwendung vorgefertigte Losungen bereitstellen kann, die mogliche Unterkunfte, Transport- und Verpflegungsmoglich keiten umfassen. Was ""Alp-Us"" bietet, ist auch fur verschiedene Dienstleister nutzlich. Eine der Aufgaben dieses Tools besteht namlich darin, Benutzer, die die App verwenden, mit Dienstleistern in Kontakt zu bringen, die die Effizienz dieses Systems nutzen konnen, um ihre Dienste auf bequemste Weise zu verkaufen.
"
G3,"<font style=""vertical-align: inherit;""><font style=""vertical-align: inherit;""><font style=""vertical-align: inherit;""><font style=""vertical-align: inherit;"">In diesem Peer Review beschreibe ich das Geschäftsmodell von (TravelNow). </font></font><font style=""vertical-align: inherit;""><font style=""vertical-align: inherit;""><font style=""vertical-align: inherit;"">Der Zweck dieser Überprüfung besteht darin, die verschiedenen Komponenten des Geschäftsmodells kritisch zu analysieren, seine Wirksamkeit bei der Erreichung der Unternehmensziele zu bewerten und Empfehlungen für Verbesserungen auszusprechen. </font></font><font style=""vertical-align: inherit;""><font style=""vertical-align: inherit;""><font style=""vertical-align: inherit;"">Stärken: Einzigartiges Wertversprechen: Das Geschäftsmodell kommuniziert effektiv das einzigartige Wertversprechen von (TravelNow). </font></font><font style=""vertical-align: inherit;""><font style=""vertical-align: inherit;""><font style=""vertical-align: inherit;"">Es identifiziert klar die wesentlichen Vorteile und Wettbewerbsvorteile, die das Unternehmen von seinen Mitbewerbern unterscheiden. </font></font><font style=""vertical-align: inherit;""><font style=""vertical-align: inherit;""><font style=""vertical-align: inherit;"">Dies ist entscheidend für die Gewinnung und Bindung von Kunden auf einem überfüllten Markt. </font></font><font style=""vertical-align: inherit;""><font style=""vertical-align: inherit;""><font style=""vertical-align: inherit;"">Umsatzgenerierung: Das Geschäftsmodell zeigt einen umfassenden Ansatz zur Umsatzgenerierung. </font></font><font style=""vertical-align: inherit;""><font style=""vertical-align: inherit;""><font style=""vertical-align: inherit;"">Es identifiziert mehrere potenzielle Einnahmequellen, wie zum Beispiel: </font></font><font style=""vertical-align: inherit;""><font style=""vertical-align: inherit;""><font style=""vertical-align: inherit;"">Dies spiegelt einen diversifizierten und nachhaltigen Ansatz für das finanzielle Wohlergehen des Unternehmens wider. </font></font><font style=""vertical-align: inherit;""><font style=""vertical-align: inherit;""><font style=""vertical-align: inherit;"">Schauchen: Wettbewerbsanalyse: Dem Geschäftsmodell fehlt eine umfassende Analyse der Wettbewerbslandschaft. </font></font><font style=""vertical-align: inherit;""><font style=""vertical-align: inherit;""><font style=""vertical-align: inherit;"">Es ist wichtig, eine gründliche Bewertung der wichtigsten Wettbewerber, ihrer Stärken, Schwächen und Marktpositionierung durchzuführen. </font></font><font style=""vertical-align: inherit;""><font style=""vertical-align: inherit;""><font style=""vertical-align: inherit;"">Diese Analyse wird (TravelNow) dabei helfen, Möglichkeiten zur Differenzierung zu erkennen und potenzielle Bedrohungen für seinen Erfolg zu verstehen. </font></font><font style=""vertical-align: inherit;""><font style=""vertical-align: inherit;""><font style=""vertical-align: inherit;"">Kostenstruktur und Finanzprognosen: Das Geschäftsmodell bietet begrenzte Informationen zur Kostenstruktur und Finanzprognosen. </font></font><font style=""vertical-align: inherit;""><font style=""vertical-align: inherit;""><font style=""vertical-align: inherit;"">Es ist wichtig, detaillierte Finanzprognosen einzubeziehen, einschließlich erwarteter Ausgaben, Umsatzprognosen und Rentabilitätsschätzungen. </font><font style=""vertical-align: inherit;"">Das wird helfen </font></font><font style=""vertical-align: inherit;""><font style=""vertical-align: inherit;""><font style=""vertical-align: inherit;"">beurteilen Sie die finanzielle Tragfähigkeit des Modells und treffen Sie fundierte Entscheidungen. </font></font><font style=""vertical-align: inherit;""><font style=""vertical-align: inherit;""><font style=""vertical-align: inherit;"">Verbesserungsvorschlag: Führen Sie eine umfassende Wettbewerbsanalyse durch: Eine gründliche Analyse der Wettbewerbslandschaft ist notwendig. </font></font><font style=""vertical-align: inherit;"">Identify key competitors, their strengths, weaknesses and market positioning. Diese analyse wird bei der entwicklung wirksamer differenzierungsstrat egien und der erfolgreichen positionnierung von hilfreich sein.</font style=""vertical-align: inherit;""></font style=""vertical-align: inherit;""></font style=""vertical-align: inherit;""></font style=""vertical-align: inherit;""></font style=""vertical-align: inherit;""></font style=""vertical-align: inherit;""></font style=""vertical-align: inherit;""></font style=""vertical-align: inherit;""></font style=""vertical-align: inherit;""></font style=""vertical-align: inherit;""></font style=""vertical-align: inherit;""></font style=""vertical-align: inherit;""></font style=""vertical-align: inherit;""></font style=""vertical-align: inherit;""></font style=""vertical-align: inherit;""></font style=""vertical-align: inherit;""></font style=""vertical-align: inherit;"">
"
G3,"Alp us hilft bei der Organisation einer Reise, z.B. bei der Planung einer Skireise in Form einer Gruppe, da es alle für eine Reise benötigten Informationen auf einer einzigen Plattform zeigt, und dass Sie die Informationen über den Ort, Informationen über die Route, um den Ort mit anderen Transportmitteln zu erreichen, und geben Sie Vorschläge individuell für jedes Mitglied der Gruppe, um den Buchungsprozess des Skigebiets und der Unterkunft und Gastronomie zu erleichtern. Die App verbindet verschiedene Buchungsfunktionen für Skigebiete, Hotelreservierungen und Transportreservierungen, um einen Umsatz für die Plattform zu generieren. Das Geschäftsmodell hört sich gut an, ist aber meiner Meinung nach nicht so sehr praktikabel. 
ich würde mir überlegen, wie es laufen könnte, dass die handwerker und händler nicht komplett voneinander getrennt sind. so könnte die konkurrenz weniger sein, sondern sie kann über die plattform ihreEs gibt auch einige Bedenken, die nicht in der App hervorgehoben wird, wie die Echtzeit-Daten des Skigebiets, die Wetterbedingungen, ist es ein Schneefall, und die Karten der Strecke. Es ist auch nicht hervorgehoben, dass die App ein Tracking der Strecke des Berges hat. Diese Funktion kann den Besuchern helfen, Routen zu finden, ohne sich im Gebirge zu verirren. Die App enthält keine Sicherheitsfunktionen wie Notfallkontakte und -warnungen sowie Informationen über mögliche Risiken.  
Eine weitere Sache, die diese App meiner Meinung nach etwas unpraktisch macht, ist der Internetzugang auf einem Smartphone in diesen abgelegenen Skigebieten. anmerkungen du könntest in deinem verbesserungsvorschlag darauf achten, dass die unpassende benennung vor dem punkt der skier vermieden wird und weitere inhalte/zielgruppen in dieser hinsicht


"
G3,"Alp us hilft bei der Organisation einer Reise, z.B. bei der Planung einer Skireise in Form einer Gruppe, da es alle für eine Reise benötigten Informationen auf einer einzigen Plattform zeigt, und dass Sie die Informationen über den Ort, Informationen über die Route, um den Ort mit anderen Transportmitteln zu erreichen, und geben Sie Vorschläge individuell für jedes Mitglied der Gruppe, um den Buchungsprozess des Skigebiets und der Unterkunft und Gastronomie zu erleichtern. Die App verbindet verschiedene Buchungsfunktionen für Skigebiete, Hotelreservierungen und Transportreservierungen, um einen Umsatz für die Plattform zu generieren. Das Geschäftsmodell hört sich gut an, ist aber meiner Meinung nach nicht so sehr praktikabel. 
ich würde mir überlegen, wie es laufen könnte, dass die handwerker und händler nicht komplett voneinander getrennt sind. so könnte die konkurrenz weniger sein, sondern sie kann über die plattform ihreEs gibt auch einige Bedenken, die nicht in der App hervorgehoben wird, wie die Echtzeit-Daten des Skigebiets, die Wetterbedingungen, ist es ein Schneefall, und die Karten der Strecke. Es ist auch nicht hervorgehoben, dass die App ein Tracking der Strecke des Berges hat. Diese Funktion kann den Besuchern helfen, Routen zu finden, ohne sich im Gebirge zu verirren. Die App enthält keine Sicherheitsfunktionen wie Notfallkontakte und -warnungen sowie Informationen über mögliche Risiken.  
Eine weitere Sache, die diese App meiner Meinung nach etwas unpraktisch macht, ist der Internetzugang auf einem Smartphone in diesen abgelegenen Skigebieten. anmerkungen du könntest in deinem verbesserungsvorschlag darauf achten, dass die unpassende benennung vor dem punkt der skier vermieden wird und weitere inhalte/zielgruppen in dieser hinsicht


"
G3,"Alp-US erleichtert die Organisation eines Skitrips mit seinen Freunden oder der Familie. Alle wichtigen Details Ihres Skitrips können sie mit Hilfe von Alp-Us zentral und unkompliziert über eine App steuern. In Alp-Us können Gruppen durch einen Gruppenleiters erstellt werden. Nach dem Erhalt des Einladungslinks durch die Teilnehmenden können Sich diese innerhalb von wenigen Augenblicken für den Trip registrieren. Während dieses Registrationsprozesses werden wichtige Informationen wie die Verfügbarkeit, Vorlieben für Skigebiet und Transportmittel individuell abgefragt. Dies bildet die Grundlage für die späteren Vorschläge durch Alp-Us. Anhand der Daten erstellt Alp-Us kombinierbare Vorschläge zu den Bereichen Transport, Skigebiet, Unterkunft und Gastronomie. Diese können modular und unabhängig voneinander direkt in der App gebucht werden. Falls Ihre Pläne etwas komplet anderes vorsehen als die genannten Vorschläge, ist es zudem möglich, nur einen Teil der Module über die App zu buchen.
Sie erhalten Vorschläge, welche Transportmittel geeignet sind für Ihren Trip. Des Weiteren erhalten Sie Vorschläge zu Skigebieten. Sie können direkt innerhalb der App die benötigten Tagespässe für die Pisten kaufen, was den Vorteil hat, dass alle Beteiligten sich jederzeit Ihr Ticket auf ihr Smartphone herunterladen können. Egal ob Einzelzimmer in einem Luxus-Hotel oder eine eigene Selbstversorger-Ferienwohnung direkt an der Piste: eine Anbindung zu Airbnb und kooperierenden Hotels und Unterkünften lässt konkrete Empfehlungen über die unterschiedlichsten Übernachtungsmöglichkeiten zu. Nachteil: Nur die kooperierenden Unternehmen kommen in die Auswahl. Auch Restaurants und Bars können Sie sich direkt vorschlagen lassen und in der App direkt einen Tisch buchen, egal ob für das Abendessen oder den Apres Ski Abend. Wir finde, eine gelungene Erfindung. Das einzige Manko ist die begrenzte Auswahl der kooperierenden Hotels und Restaurants, was jedoch durch eine eigene Recherche und Buchung auch ausserhalb der App erledigt werden kann. Somit eine klare Empfehlung, um seinen nächsten Skitrip mit seinen Freunden professionell und zeitsparend zu planen und organisieren.
"
G3,"Alp-US erleichtert die Organisation eines Skitrips mit seinen Freunden oder der Familie. Alle wichtigen Details Ihres Skitrips können sie mit Hilfe von Alp-Us zentral und unkompliziert über eine App steuern. In Alp-Us können Gruppen durch einen Gruppenleiters erstellt werden. Nach dem Erhalt des Einladungslinks durch die Teilnehmenden können Sich diese innerhalb von wenigen Augenblicken für den Trip registrieren. Während dieses Registrationsprozesses werden wichtige Informationen wie die Verfügbarkeit, Vorlieben für Skigebiet und Transportmittel individuell abgefragt. Dies bildet die Grundlage für die späteren Vorschläge durch Alp-Us. Anhand der Daten erstellt Alp-Us kombinierbare Vorschläge zu den Bereichen Transport, Skigebiet, Unterkunft und Gastronomie. Diese können modular und unabhängig voneinander direkt in der App gebucht werden. Falls Ihre Pläne etwas komplet anderes vorsehen als die genannten Vorschläge, ist es zudem möglich, nur einen Teil der Module über die App zu buchen.
Sie erhalten Vorschläge, welche Transportmittel geeignet sind für Ihren Trip. Des Weiteren erhalten Sie Vorschläge zu Skigebieten. Sie können direkt innerhalb der App die benötigten Tagespässe für die Pisten kaufen, was den Vorteil hat, dass alle Beteiligten sich jederzeit Ihr Ticket auf ihr Smartphone herunterladen können. Egal ob Einzelzimmer in einem Luxus-Hotel oder eine eigene Selbstversorger-Ferienwohnung direkt an der Piste: eine Anbindung zu Airbnb und kooperierenden Hotels und Unterkünften lässt konkrete Empfehlungen über die unterschiedlichsten Übernachtungsmöglichkeiten zu. Nachteil: Nur die kooperierenden Unternehmen kommen in die Auswahl. Auch Restaurants und Bars können Sie sich direkt vorschlagen lassen und in der App direkt einen Tisch buchen, egal ob für das Abendessen oder den Apres Ski Abend. Wir finde, eine gelungene Erfindung. Das einzige Manko ist die begrenzte Auswahl der kooperierenden Hotels und Restaurants, was jedoch durch eine eigene Recherche und Buchung auch ausserhalb der App erledigt werden kann. Somit eine klare Empfehlung, um seinen nächsten Skitrip mit seinen Freunden professionell und zeitsparend zu planen und organisieren.
"
G3,"Alp-Us ist ein gutes Tool, um seinen Skitrip mit Freunden oder Verwandten zu Planen und zu Organisieren. Die Zeitersparnis des Produktes ist immens im Vergleich zu einer Eigenrecherche des Planers (hier Gruppenleiters). Durch die Registrierung und die gleichzeitige Abnahme der Präferenzen aller Teilnehmer ist gewährleistet, schon bevor die Planung beginnt alle relevanten Punkte gesammelt zu haben. Die Aufteilung in vier Module ergibt aus meiner Sicht auch Sinn. Vielleicht wäre es empfehlenswert, noch ein zusötzliches Modul mit weiteren Aktivitäte, z.b. Wanderrouten in der Nähe oder eine Therme, mit aufzunehmen. Das würde Personen, die weniger Ausdauer und Übung haben als andere in der Gruppe, nicht direkt ausschließen oder zu einem Tag im Hotel zwingen, wenn sie weniger Tage als die anderen Ski fahren möchten. Das Modul der Skigebiete mit den Skipässen sollte auch direkt die Zahlungsfunktionen beinhalten, die man gängigerweise kennt (Kreditkarte, Banküberweisung, Paypal). Auch eine Integration in die Wallets von Iphone und android sollte gegeben sein. Bei den Hotels und der Gastronomie ist es wichtig, dass so viele Lokalitäten wie möglich in allen zur verfügung stehenden Skigebieten teilnehmen und auswählbar sind. Ernüchternd ist es, wenn man ein Skigebiet auswählt, dann aber nur Hotels außerhalb des Budgets oder überhaupt keine mehr verfügbar sind und man dann nochmal neu planen muss. Das zerstört die gewonnene Zeitersparnis. Auch möglich solte eine Verknüpfung mit seinem Airbnb-Konto sein. Bei den Lokalitäten sollte ein ausgewogener Mix an verschiedenen Kulturen verfügbar sein, also deutsche, italienische, weitere Küchen. Auch sollten hier nicht nur Restaurants, sondern auch Bars oder Clubs mit angezeigt werden. bei letzterem wird dann aber vermutlich eher weniger reserviert im Vorfeld.
"
G3,"Alp-Us ist eine benutzerfreundliche Anwendung, die Benutzern eine einfache Möglichkeit zur Planung von Skiausflügen bietet. Die Alp-us-Anwendung ist als zentrale Anlaufstelle für alle Benutzerbedürfnisse bei der Vorbereitung und Planung eines Skiausflugs konzipiert. Das Alp-U-Anwendungstool ist insofern von Vorteil, als es Benutzern die Möglichkeit bietet, Skiausflüge, Unterkünfte, Transportmittel und Restaurants im Skigebiet selbst zu planen. Es ist eine zentrale Anlaufstelle für alle Benutzerbedürfnisse Dadurch können Sie alle oben genannten Aktivitäten im Hinblick auf ihre Planung in einer einzigen App durchführen. Darüber hinaus ermöglicht dieses Tool den Benutzern eine Multi-User-Oberfläche, die es anderen wie Freunden und Familie ermöglicht, bestimmte Aktivitäten oder Buchungen auszuwählen, die ihnen gefallen. Benutzer können diese Funktion ausführen, indem sie einen aktiven Link mit einem geliebten Menschen teilen, der es diesem Benutzer ermöglicht, auf Informationen über das Resort zuzugreifen und seine Planung entsprechend dem zu gestalten, was ihm speziell gefällt und gefällt. Die Alp-Us-Anwendung ist sehr benutzerfreundlich und sehr umfassend, da sie über ein umfassendes Buchungssystem verfügt, das es einem ermöglicht, aktiv an einer Schnittstelle zu arbeiten, anstatt Buchungen über verschiedene Websites und Anwendungen vorzunehmen. Die Anwendung könnte dahingehend verbessert werden, dass sie es den Benutzern möglicherweise ermöglichen sollte, ein Konto zu erstellen und vom Hauptbenutzer aus die Möglichkeit zu haben, über ihr Profil für die Urlaubsreise hinzugefügt zu werden und auf diese Weise auf die Reisedetails zuzugreifen, einen Abschnitt für Kommentare hinzuzufügen usw Verfolgen Sie die Änderungen, die Sie vorgenommen haben. Außerdem könnte die Anwendung eine Checkliste für jeden einzelnen Benutzer haben, was er vielleicht auf der Reise erleben möchte, unter verschiedenen Rubriken wie „Essen“, „Unterkunft“ und aus den vom Benutzer getroffenen Auswahlen kann die Anwendung auswählen Generieren Sie auf diese Weise Optionen für den Benutzer, um es einfacher zu machen. Diese Anwendung bietet großes Wachstums- und Erweiterungspotenzial Es scheint einfach zu bedienen und sehr leicht zu erlernen und zu verstehen zu sein.
"
G3,"Alp-Us ist eine interessante Geschäftsidee, dass einen Service für viele Menschen bieten kann, die im Winter mit Freunden oder Familie reisen möchten. Der Idee kommt mehr Wert zu, da Themen wie Restaurants, Hotels und Aktivitäten berücksichtigt werden. Die plattform kommt vor flächendeckender anwendung. Aber es gibt ein paar Probleme. Da es sich um eine App handelt, die sich auf den Winterurlaub konzentriert, zu anderen Jahreszeiten ist diese App nicht besonders aktiv.

Ich würde empfehlen, den Schwerpunkt weiterhin auf die Winterferien zu legen, aber gleichzeitig Aktivitäten und Pläne einzubeziehen, die denselben Gruppen an anderen Orten und zu anderen Jahreszeiten helfen können.

Vielleicht ist die App auf Winter und Schnee ausgerichtet, aber es wäre auch eine großartige Gelegenheit, andere Arten von Aktivitäten einzubeziehen, da die Benutzeroberfläche des Modells gut ist (vor allem, da es möglich ist, Einladungen zu senden und zu empfangen, um Pläne umzusetzen und loszufahren). unterwegs mit Freunden und der Familie) und konnte daher allen möglichen Menschen bei ihren eigenen Plänen helfenund somit auch allen möglichen situationen helfen. diese punkte könnte man noch mit aufnehmen und später in die beiden aufgaben einarbeiten und für alle glieder des customer prozesses verwendet werden.  
Interessant ist auch, wie man in der Bewerbung weitere Personen einladen kann, um diese in die Planung und Spesen mit einzubeziehen. So etwas habe ich bei anderen Arten von Anwendungen noch nie gesehen. Unter Berücksichtigung der Probleme der Aktivität und anderer Aspekte denke ich, dass diese Anwendung bei der Entwicklung von Anwendungen mit Schwerpunkt auf der Planung helfen könnte. Ein weiterer ansatz wäre, den nutzer durch die möglichkeit der einzahlung spiele zu beraten.



"
G3,"AlpUs ist eine Plattform, die es ermöglicht, Skiurlaube mit Freunden und Familie einfacher zu organisieren. Dabei wird es ermöglicht den Urlaub selbst und ebenfalls die Anreise zu planen. 
Hierbei hilft die Plattform dabei, die Urlaubszeiten abzustimmen und Präferenzen von den Mitfahrern abzufragen. 
Es werden automatisch Vorschläge zu Skiorten und anderen Freizeitaktivitäten, wie Restaurants oder Sehenswürdigkeiten gemacht. 
Die Plattform monetarisiert die getätigten Buchungen bei den Partnerunternehmen, wobei dem Endkunden keine zusätzlichen Kosten entstehen, sondern dieser nur die Vorteile der Plattform, wie leichte Planbarkeit, Übersichtlichkeit der Angebote, Vergleichen von Angeboten und anschließend die direkte Buchung hat. Damit verlagert man den Schwerpunkt des Wertaustausches vom Endkunden hin zum Plattformanbieter, was die Nachhaltigkeit der Plattform unterstreicht.
Ein großer Vorteil ist, wie leicht es dem Planer des Ausfluges gemacht wird, viele Wünsche zu vereinen und damit einen zufriedenstellenden Urlaub für alle Mitfahrenden zu planen. Eine große Herausforderung der Plattform AlpUs wird sein, dass es schnell zu einer gewissen Größe von Partnern heranwachsen muss, um für den Großteil der Skifahrer interessant zu werden. Hier sehe ich eine große Herausforderung, da dies viel Überzeugungsarbeit bei den lokalen Partnerrestaurants, hotels, Skigebieten, Öffis bedarf. 
Eine weitere Idee zur Fortentwicklung der Plattform AlpUS wäre, die Plattform nicht nur für Ski Reisen zu öffnen sondern auch für andere Tourismusarten in den Bergen oder generell für Tourismus. Sozusagen ein online Reisebüro, welches einem hilft den Trip holistisch zu planen. 
Zudem sollte das gezeigte Werbevideo überarbeitet werden und nicht nur rational an den Kunden heran treten, sondern auf die emotionale Ebene des Urlaubs abzielen und wie viel einfacher die Planung wird und dadurch der Spaß im Urlaub maximiert. Eine nicht so monotone Stimme und etwas Musik gepaart mit Bildern wären nicht schädlich. Generell sollte der Werbeauftritt sehr gut gepflegt sein, um mit Konkurrenten wie Airbnb und Booking.com mithalten zu können. Zu erst könnten die Zielgruppen als technisch bewusste Skifahrer definiert werden.   

"
