92,64.0,G3,"AlbUs ist ein modernes digitales tool das es Individuen und Gruppen ermoeglicht personalisierte, kombinierbare Module wie Gastronomie, Unterkunft, Skigebiet und Transport zu buchen. So koennen zB auch preferences zu Mobilitaetsoptionen angegeben werden.  Ueber die Zentrale Buchung mit dem Mobile App kann man sowohl Preis daten also auch Informationen zu verschiedenen Ski Gebieten erfragen. AlbUs ist somit ein Frontrunner in modernen digitalisierten TravelApps welche Personalisierung der Reise ermoeglichen, und effizient zwischen Kunde und Anbieter vermitteln. Diese Interface zwischen Service Providern und Endkunde klingt dynamisch und up to date um optimale Vorschlaege zu Preisen, Vermittlung von Anbietern und vielem Anderen zu ermoeglichen. Auch an Peer Bewertungen und Bewertungen der Gebuchten services wird gedacht. Positiv ist auch dass Alb Us vom Anfang der Buchung bis Ende des Urlaubes erreichbar ist, und auch intervenieren kann wenn es zu Beschwerden kommt. (Der Beschwerde/Kompensations Prozess muesste transparenter beschrieben werden). Auch ist unklar inwieweit online Data-Security garantiert ist. Alb Us ist ein viel-versprechendes App mit dem sich individualisierte Ski Urlaube buchen lassen. Die Interface zwischen Alb Us und Anbietern bzw Endkunden klingt transparent und leicht navigierbar. Obwohl dieses App individuell massgeschneiderte Angebote zusammenstellen kann, waere es notwendig diese noch zu vertiefen zB bei dem Modul ""Gastronomie"" waere es wichtig sowohl Diaeten anmelden zu koennen, als Beispiel bei Diabetes, als auch bevorzugte Kost wie zB Vegan. In diesem Sinne waere auch Signposting wichtig als Beispiel bei moeglicher Erkrankung, Knochenbruechen etc. Wenn das Ski Gebiet gewaehlt wurde wuerde das Signposting automatisch signalisieren wo in dem Dorf der naechste Arzt bzw Zahnarzt ist. Die Tatsache dass Alb Us Mobilitaetsoptionen anbietet bei dem Transport Module ist hoechst Positiv. Es waere auch hilfreich wenn Kinderspezifischen Module angeboten wuerden die zusaetzlich zu den schon angegebenen Modulen auch Links zu Aktivitaeten in dem Ski Resort anzeigen welche man buchen kann. Ein Anderer Link waere zB zu individuellen Requirements wie das mitbringen von Blindenhunden. 
",1686047548.0,APPROVED,2023-06-06T09:39:29.673000Z,2023-06-06T10:40:49.578000Z,2023-06-08T09:55:50.194000,2023-06-06T10:40:49.944169Z,3680.0,C4FP4UXH,1172.0,"English, German",Undergraduate degree (BA/BSc/other),71.0,Female,Mixed,Austria,United Kingdom,United Kingdom,German,No,Part-Time,
93,59.0,G3,"Dieses Modell scheint gut konzipiert und durchgedacht zu sein. Es ist klar, dass die Macher einige Zeit damit verbracht haben, es zu entwickeln. Mir gefällt besoders die Tatsache, dass es sich um eine Handy-App handelt, weil sie so einfach zu Bedienen ist. Solche Apps sind normalerweise intuitiv und leicht zu erlernen. Ausserdem besteht die Möglichkeit, das Erlebnis durch Spiele zu erweitern. Es wäre interresant zu sehen, ob es nicht das Potenzial für eine Monetarisierung durch die Einblendung personalisierter Werbung gibt. Die Stärke dieser Idee liegt in ihrem klaren Fokus. Ein Sportgebiet - der Skisport - bedeutet eine klar definierte Gruppe von Kunden und Dienstleistern. Auch die Tatsache, dass diese App für Gruppen von Benutzern funktioniert, ist gut. Einladungslinks sind eine praktikable Lösung.  Einer der Schwachpunkte, die ich sehe, ist die fehlende Klarheit darüber, wie der Betrieb dieser App finanziert werden soll. Wer wird zahlen? Die Dienstanbieter - eine feste Gebühr? Oder ein Prozentsatz der Transaktionen? Wie hoch wird der Prozentsatz sein? sollten die App Nutzer nicht auch zahlen? Könnte es eine Premium Version der app ohne Werbung geben? Mit vielleicht mehr Funktionen?  Ein weiterer Schwachpunkts is das begrentzte Angebot an Unterkunftanbietern. Ess müssen nicht nur Buchungsysteme von Drittanbietern, sondern auch individuelle Hotels und apartments und Fe-Wos angeboten werden. Diese app würde schnell zu einer ""vierten Partei"" im gesamten Prozess werden und das könnte zu viel Verwirrung führen. Der Schutz personenbezogener Daten ist ein weiteres Anliegen. Die Entwickler dieser App müssen sicherstellen, dass diese App GDPR-konform ist. Vor allem, da sie personenbezogene Daten von mehreren Nutzern und mögkicherweise auch Minderjährigen verarbeitet. Ich würde gerne ein Paar Pünkte vorschlagen, um diese App verbessern: eins - Aufnahme von Diätvorschriften in die Nutzprofile der App, damit die gezielten Angebote von restaurants und Kneipen in de Umgebung bereits Orte herausfiltern, ann denen bestimmte Personen bestimmte Dinge nich essen können. Zwei: die Option anbauen, eine Versicherung für Verlůetzungen und den Verlust von Ausrüstung abzuschliessen. 
",1686048006.0,APPROVED,2023-06-06T10:06:28.455000Z,2023-06-06T10:44:53.519000Z,2023-06-08T09:55:50.743000,2023-06-06T10:44:53.972070Z,2306.0,C4FP4UXH,1264.0,"Czech, English, French, German, Russian, Slovak",Graduate degree (MA/MSc/MPhil/other),41.0,Female,White,Czech Republic,Czech Republic,Czech Republic,Czech,Yes,Full-Time,
94,77.0,G3,"ueDie Idee is sehr interessand und ungewöhnlich. Sicherlich werden viele Gruppen an solchen Lösung interessiert sein, wenn sie eine Art von Urlaub machen wollen. Die Auswahl and Möglichkeiten, die sie haben  und wie sie aktivitäten erledigen sollen, macht in einem sehr guten bzw. sehr kreativen bpmn grund, welches das ganze wirklich einfach gestalten kann. Es kann jedoch problematisch sein, Entscheidungen in einer Gruppe yu treffen, in der viele Menschen unterscheidliche Bedürfnisse und Interessen haben und einige Mensch sich auf andere Weise retten wollen als die Mehrheit der Gruppe. Ein weiteres Problem könnte sein, wie teuer die Lösungen sein wird. Wird App eine Gebühr erheben? Wenn es sich um eine komplex Tour handelt, könnte die Lösung für Gruppen teuer werden. Wenn wir Pläne haben, die von der App erstellt wurden, wird es dann möglich, alles zu ändern? Bei solchen Reisen ist ein gewisses Mass an Flexibilität erforderlich. Das Problem könnte auch sein, wie viele Menschen solche Anwendung nutzen können. Würden dadurch nicht ältere Menschen ausgeschlossen? Einer der grössten Pluspunkte ist sicherlich die Bequem. Die Anwendung bietet eine grosse Anzahl von Lösungen, Hotels, Restaurants und Skigebiete. Zu einem grossen Teil wird es möglich sein, den Urlaub an Ihre Bedürfnisse anzupassen. Es wäre auch gut, wenn der Wettbwereb an einem Ort stattfinden würde. Dies kann zu wettbewerbsfähigen Preisen führen. Auch AI-Technologien können zum Einsatz kommen. Wenn Sie Ihre Daten und Präferenzen in Ihr Profil eingeben, können Sie die besten Optionen auswählen. Kunde wird seinen Urlab stressfrei vom heimischen Sofa aus planen können. Abschliessen lässt sich sagen, dass die Idee ein grosses Potenzial hat und es sich lohnt, in diese Technologie zu investieren. Es gibt einige Nachteile, die jedoch in verschiedenen Stadien bewältigt werden können. Es ist sicherlich eine gute Lösung für junge Menschen, die mit neuen Technologien vertraut sind und sie täglich nutzen. Kosten und Risiko sind nicht hoch!
",1686048066.0,APPROVED,2023-06-06T10:06:36.902000Z,2023-06-06T10:47:06.023000Z,2023-06-08T09:55:55.983000,2023-06-06T10:47:06.436086Z,2430.0,C4FP4UXH,156.0,"English, German, Polish",Graduate degree (MA/MSc/MPhil/other),27.0,Male,White,Poland,Poland,Poland,Polish,Yes,Full-Time,
95,149.0,G3,"Zuerst möchte ich die grundsätzliche Idee loben, da es ein offensichtliches Problem für Menschen, die einen Skiurlaub machen möchten, löst. Ich finde gut, dass den Kunden nicht nur die Möglichkeit geboten wird, ein Skiticket zu kaufen, sondern auch Unterkunft, Gastronomie und Transport zu buchen. Auf der anderen Seite frage ich mich, ob Kunden der App auch wirklich z.B. eine AirBnB Wohnung über die App buchen, anstatt dies über die AirBnB-App zu tun - hier könnte man noch den Nutzen hervorheben, den der Kunde bekommt, wenn er über die Ski-App bucht. Außerdem enthält der Pitch keine Information darüber, wie das Problem des cold-starts gelöst werden kann - da die App sehr stark von Netzwerkeffekten profitiert, muss man sich überlegen, wie man möglichst viele Unternehmen und Kunden anziehen kann in kürzester Zeit. Schafft die App dies nicht, könnte es schwierig werden, profitabel zu werden (angenommen die App ist für Nutzer gratis). Außerdem wäre es interessant zu wissen für Kunden, ob die App Werbung anzeigt oder nicht - sollte sie Werbung anzeigen, ist es für Kunden definitiv angenehmer über Plattformen Services zu buchen (z.B. AirBnB), bei denen keine Werbung angezeigt wird. Deswegen sollte das Geschäftsmodell ohne Werbung auskommen und seine Einnahmen anderweitig beziehen. Zusammenfassend ist die Geschäftsidee vielversprechend, aber die Unique Selling Proposition sollte nochmal besser herausgearbeitet werden, damit besser verständlich ist, was die App von bisher existierenden Plattformen unterscheidet und warum Kunden sie benutzen sollten. Wäre ich ein Investor, würde mich das Video noch nicht 100% überzeugen, da wie bereits erwähnt, eine Idee fehlt, wie man das cold start problem beim Launch der App löst.
",1686048424.0,APPROVED,2023-06-06T10:17:02.450000Z,2023-06-06T10:50:38.068000Z,2023-06-08T09:55:56.737000,2023-06-06T10:50:38.504514Z,2016.0,C4FP4UXH,16.0,"German, English",Undergraduate degree (BA/BSc/other),25.0,Male,White,Germany,Germany,Germany,German,Yes,Other,
96,118.0,G3,"Als Erstes wollte ich gleich erwähnen, dass ich von dem Namen für die App richtig begeistert bin. Ich finde, es passt super zum Produkt und man kann es sich auch leicht merken. Ich gehöre zwar nicht direkt zu der Zielgruppe, aber in meinem Freundeskreis finden sich einige Leute für die diese Idee Sinn macht.  Insgesamt finde ich das Geschäftsmodell grundsätzlich gut durchdacht, jedoch denke ich, dass da vielleicht noch mehr Funktionalität eingebaut werden kann, zum Beispiel Polls zum Wählen der besten Optionen, oder Chat. Es kann ja durchaus passieren, dass sich nicht alle in der Reisegruppe einig sind, wenn mehr Vorschläge gemacht werden. Es würde mich auch interessieren, wie genau die Vorschläge von der App erstellt werden, ich hoffe, es sind verlässliche Algorithmen für die Auswahl eingebaut, schliesslich hängt der finanzielle Erfolg davon ab wie viele Nutzer die angebotenen Leistungen gut genug finden, um sie auch direkt über die App zu buchen. Was ich richtig gut finde ist die Tatsache, dass man die Vorschläge nicht automatisch über die App buchen muss, obwohl da auch ein wenig die Gefahr lauert für das Modell (wenn es halt allzu viele Menschen nur zur Inspiration nehmen und das Geld dann woanders ausgeben). Ich halte es für wichtig, dass die Preise und Kosten für die Endverbraucher wettbewerbsfähig sind, damit sie über die App so viel wie möglich bestellen /  buchen. Was ich noch interessant finden würde in der App wären Wetterinfos und Pistenkarten. Dann kann in noch mehr Detail die Reise ausgemacht und geplant werden. Ich würde gerne noch mehr erfahren über das Design der App, das kann einen riesigen Unterschied ausmachen wenn es darum geht User zu werben und zu behalten. Wenn es richtig user friendly gestaltet wird, kann ich mir vorstellen dass viele Leute angesprochen werden und es mindestens testen wollen. Ich wünsche dem Alp Us Team auf jeden Fall viel Erfolg mit Ihrer Idee! <span class=""inline-suggestion""> ansonsten good job! :-) /-  - gut erörtert, bis auf wenig beschreiben ursache der ankündigung, da mir die generellen möglichkeiten und die preiskonkur</span>
",1686048723.0,APPROVED,2023-06-06T10:28:31.076000Z,2023-06-06T10:58:33.894000Z,2023-06-08T09:55:52.187000,2023-06-06T10:58:34.357672Z,1803.0,C4FP4UXH,197.0,"Czech, English, German, Russian, Slovak",Graduate degree (MA/MSc/MPhil/other),42.0,Female,White,Slovakia,United Kingdom,Slovakia,Slovak,No,Full-Time,
97,99.0,G3,"Ich finde es toll, dass die Anwendung verschiedene Dienstleister für Unterkunft, Transport, Aktivitäten und Verpflegung hat. Es wird für die Gruppe einfacher Die Anwendung muss farbenfroh sein und Spaß machen, damit es nicht langweilig wird, in der Anwendung herumzuspielen.  Es sollte auch einfach zu bedienen sein, da einige Leute Schwierigkeiten haben, in Anwendungen zu navigieren. Sie sollten auch Optionen für Flugreservierungen und Krankenhäuser im Falle von Verletzungen hinzufügen.sein, ihre Dienstleister auf einen Schlag zu finden. Restaurants sollten jedoch verschiedene Menüs hinzufügen, um Menschen mit unterschiedlichen Essensprioritäten gerecht zu werden. Sie sollten auch ein Bekleidungsgeschäft mit wärmerer Kleidung hinzufügen, da die Leute dazu neigen, sie zu vergessen. Sie sollten auch Kundenbewertungen für die verschiedenen Dienste in der Anwendung abgeben, damit die Leute genau wissen, wie der Ort ist, und nicht überrascht Die Anwendung muss sich an Menschen aus verschiedenen Gesellschaftsschichten richten und übe Insgesamt liebe ich die Anwendung, da sie den wichtigsten Dienstleister hat, der am meisten gesucht wird, wie Unterkunft, Verpflegung und Transport. Es wird für ein Team einfacher sein, seine Reservierungen vorzunehmenr Luxus- und gewöhnliche Boutiquen verfügen. Sie sollten auch Spas haben, in denen die Menschen ihre Muskeln nach einem langen Ski- und Tourentag entspannen können. Apotheken sind auch von Nutzen, wenn jemand seine Medikamente vergisst, sie kaufen einfach in der Apotheke nach Belieben. Sie sollten auch Flüge und Hubschrauber in die Anwendung aufnehmen, falls die Leute einen Hubschrauberflug machen und eine Luftaufnahme des Ortes haben möchten werden. Sie sollten auch einige touristische Sehenswürdigkeiten hinzufügen, damit die Menschen erkunden und auswählen können, wohin sie gehen möchten.
",1686048795.0,APPROVED,2023-06-06T10:31:41.625000Z,2023-06-06T10:57:54.633000Z,2023-06-08T09:55:57.879000,2023-06-06T10:57:55.351097Z,1574.0,C4FP4UXH,723.0,"English, French, German, Portuguese, Swahili, Other",Graduate degree (MA/MSc/MPhil/other),34.0,Male,Mixed,Zimbabwe,South Africa,Zimbabwe,English,Yes,Full-Time,
98,128.0,G3,"Das präsentierte Geschäftsmodell sieht vor, durch den Modularen Aufbau alle einzelnen Schritte der Urlaubsplanung zu vereinen. Dadurch könnnen bisher unabhängige Schritte vereint werden, wodurch den Kund:innen ein Großteil der Arbeit abgenommen wird. Das ist eine starke Leistung, da dadurch Unternehmen besser kooperieren können und die Kund:innen ihre Vorstellungen besser umsetzen können. Es können so zudem Gruppenplanungen vereinfacht werden, wodurch ein Großteil der Ski-Tourist:innen angesprochen würde. Es wird in der Vostellung des Geschäftmodell allerdings nicht präzise dargestellt, welche UNternehmen teilhaben können. Um solch eine App an den Markt zu bringen, müssten bereits Unternehmen von Beginn an teilnehmen. Es wurde meiner Meinung nach noch nicht genügend der Gewinn dieser UNternehmen verdeutlicht. Außerdem ist nicht spezifizeiert, ob die App allein durch die Bezahlung durch die UNternehmen funktioniert. Laut Vorstellung, zahlen die Kund:innen nicht direkt and die App, es ist unklar, ob dies ausreicht für die Finanzierung. EIn weiterer fehlender Aspekt ist, dass nicht genau erklärt wird, wie genau die Kund:innen dann Urlaube planen können. Genauer gesagt wird nicht beschrieben, ob die einzelnen Kund:innen/ Gruppen auch zwischen verschiedenen Optionen wählen können und eigene Vorschläge/ Auswahlen einbringen können. Dadurch würde die automatische Generierung zwar schwieriger werden, es könnten jedoch auch noch besser die eigenen Vorstellungen berücksichtigt werden. Um alle Kund:innen, insbesondere die jüngeren, anzusprechen, sollte die App ansprechender gestaltet sein als die Präsentation. Dort wurde sehr sachlich und eintönig geredet und bildlich dargestellt. Zudem muss auf gendergerechte Sprache geachtet werden. Alles in Allem scheint die App eine innovative Idee zu sein, mit der in der Tourismusbranche, besonders in Urlaubszielen, in denen Gruppenurlaube populär sind, einiges erneuert und verbessert werden könnte. Die modulare Planung wird schon bei anderen Buchungsseiten genutzt, jedoch nicht in solch einer Art von Urlaub. Es müssten lediglich die Finanzierung der App und die Teilnahme der Unternehmen spezifiziert werden, um das Modell allumfassender und ausbaufähiger zu gestalten. 
",1686048934.0,APPROVED,2023-06-06T10:27:16.810000Z,2023-06-06T10:59:17.143000Z,2023-06-08T09:55:51.840000,2023-06-06T10:59:17.827967Z,1921.0,C4FP4UXH,40.0,"English, German, Italian",High school diploma/A-levels,23.0,Female,White,Germany,Germany,Germany,German,Yes,"Not in paid work (e.g. homemaker', 'retired or disabled)",
99,142.0,G3,"iAlp-Us ist eine neue App zur vereinfachten und individuellen Planung und Organisation von Ihrem Skitrip mit Freunden, Bekannten oder der Familie an einem Ort und unter Berücksichtigung von individuellen Vorlieben und Präferenzen. Alp-Us bietet die Möglichkeit, über eine verantwortliche PErson eine Gruppe zu erstellen. Die einzelnen Gruppenmitglieder, die mit auf den Skiausflug kommen möchten, erhalten einen Einladungslink. Sobald Sie die Einladung annehmen, können Sie sich registrieren. Der besondere Clou ist, dass während des Registrierungsprozesses bereits die Vorlieben zu Skigebiet, Restaurants, Hotels oder Übernachtungsmöglichkeiten und den verfügbaren Zeiträumen abgefragt werden. Alp-Us erledigt dann mit einem eigens für diesen Zweck programmierten Algorithmus die gesamte Planung. Nun kann man alle Buchungen rund um den Trip vom Transport bis zum Abendessen auf der Piste direkt in der App erledigen. Wichtig ist hierbei, dass man nicht gezwungen wird, alles über die App abzuwickeln. Wenn Alp-Us zum Beispiel vorschlägt, dass die Gruppe per Zug zum Skigebiet reist, kann man dennoch entscheiden, per Auto anzureisen. Alle Skipässe können direkt in der App erworben und bezahlt werden. Sobald die Pässe einmal in der App hinterlegt sind, kann jedes Gruppenmitglied, das registriert ist, sein Ticket ganz bequem auf sein Smartphone laden. Die Buchung einer Unterkunft über airbnb oder bei registrierten Hotels kann ebenso simpel und schnell in der App erledigt werden wie auch die Reservierung des Mittagessens oder nes Tisches beim Apres Ski. Somit sind keine weiteren anwendungen möglich und die gesamte Planung des Urlaubs wird zentral an einem ORt gemanaged und dokumentiert. Einziger Nachteil dieses Konzeptes ist, dass man auf die kooperierenden Hotels und Restaurants limitiert ist. Somit hat man weniger Auswahl als wenn man den Trip einzeln und auf eigene Faust über das Internet zusammenstellt. Doch dieser Zeitaufwand ist immens, weshalb wir die App Alp-Us als sehr gutes Instrument für die Planung eines Skitrips sehen, auch wenn man Sie nur als Unterstützung und Ideengebend nutzt. 
",1686049079.0,APPROVED,2023-06-06T10:35:17.318000Z,2023-06-06T11:00:25.129000Z,2023-06-08T09:55:52.710000,2023-06-06T11:00:25.604048Z,1508.0,C4FP4UXH,22.0,"English, German",High school diploma/A-levels,27.0,Female,White,Germany,Germany,Germany,German,No,Full-Time,
100,55.0,G3,"aThe business idea of this new app we just saw allows to the users and especially to the ones who love ski, to organize easier and faster their vacations. One of the strenghts of this app, it is the fact that everything can be booked through one app and be shared with the rest of the team. In this way everybody are aware of the place they will stay, the place they will eat, the area they can visit and when, as well as the vehicle they will use, in case they do not take their own. Also, it allows to the team to save time on searching around different sites and try to organize their trips, avoiding that way any miscommunication that could occur. Regarding the weaknesses, I do not believe I can spot any at this very moment. Nevertheless, there are some suggestions which could attract more people to use the app and be accessible from everybody any given time from everywhere. First suggestion has to do with the promotion of the app and how to attract more users. Such idea could be a package of transportation and accommodation depending on the place and time someone want to travel with a discounted price. Also, depending on the group and how often someone is using the app, they can earn points which can be redeemed at the shops of the place they want to visit, so they can rent ski equipment at lower prices. Last but not least, there should be an offline version of the app, so as the group can have access in it from any place and given the fact that the users are visiting mountain areas, the internet is not always accessible in these regions. 
",1686049094.0,APPROVED,2023-06-06T10:12:05.542000Z,2023-06-06T11:02:41.122000Z,2023-06-08T09:55:56.550000,2023-06-06T11:02:41.784846Z,3036.0,C4FP4UXH,439.0,"English, Greek, German",Undergraduate degree (BA/BSc/other),32.0,Male,White,Greece,Greece,Greece,Greek,No,Full-Time,
101,141.0,G3,"Zunächst erscheint mir Alp-Us ein zweckgerichtetes Business Modell zu sein. Es wirkt durchdacht und benutzerfreundlich um somit auch final auf den Markt gebracht zu werden.  Ich habe keine grammatikalischen Fehler entdeckt oder gefundene Lösungs-Fehler. Was man noch verbessern würde wäre der Fokus des Business, der zu allgemein formuliert wurde. Um dem entgegenzuwirken  könnte man  den Prozess noch verständlicher erklären. Es wäre super wenn es möglich wäre, die Anforderungen noch ganz zu definieren.  Aus diesem Grund würde ich die Bewertung in der Suche nach Kunde etwas abändern, weil viele Kunden die Bewertung als notwendig benennen.  ""Kundennutzer"" finden ansonsten eine sehr interessante und spannende Customer Journey. Details wurden sorgfältig erfasst und beschrieben.  Auf der Seite wurde nicht genau gekennzeichnet, welche Aktivitäten auf welcher Seite stattfinden. Es wurde nicht beschrieben, ob die App die wichtigsten Aktionen erfüllt und ob es denkbar sein könnte, dass der geliehene Spruch per App oder Reprise öffentlich auf der Plattform gesendet werden könnte.  Ausserdem könnten die Lieferanten auf der Plattform den Spruch im turnusmäßigen Verkehr wörtlich auf die Plattform posten. Grundsätzlich fehlt mir langjährige Erfahrung beim verfolgen des Spruchs und der Lösung von Versicherungen.  Echt sehr toll finde ich die Idee, dass man die Versicherung einfach über Partnerschaft kennenlernen kann.  Die Plattform bietet verschiedene Services an und zum einen eine Bescheinigungsfunktion und auch die Möglichkeit, das die Versicherungen miteinander kommunizieren können.  Teilweise funktioniert es auch gleich den Service abzustreichen und in der Vorlesung praktisch. Der Service ""Auf Wunsch/Nach Bedürfnissen (Guidance, Support und Protection)"" verschönert den Gedanken nochmals. Als Kritikpunkt ist mir aufgefallen, dass kleinere Service Anbieter in Alp-Us kaum mit größeren konkurrieren können, da durch in-App-Aufpreise ein hoher Preis verharrt. Allerdings sind sie ebenfalls den Lieferanten tatsächlich gegenüber gestellt und können zudem von den Leistungen von einer eigene Plattform profitieren. Als Fazit  ist es aber auf jeden fall schlüssig, dass zwischen dem kunden und dem Service-Anbieter kein Geldfluss existiert.     
",1686049167.0,APPROVED,2023-06-06T10:11:02.544000Z,2023-06-06T11:05:20.108000Z,2023-06-08T09:55:56.370000,2023-06-06T11:05:20.516250Z,3258.0,C4FP4UXH,12.0,"English, German",High school diploma/A-levels,18.0,Male,White,Germany,Germany,Germany,German,Yes,Unemployed (and job seeking),
