54,,G2,"AlpUs ist eine Plattform, die es ermöglicht, Skiurlaube mit Freunden und Familie einfacher zu organisieren. Dabei wird es ermöglicht den Urlaub selbst und ebenfalls die Anreise zu planen.
Hierbei hilft die Plattform dabei, die Urlaubszeiten abzustimmen und Präferenzen von den Mitfahrern abzufragen. 
Es werden automatisch Vorschläge zu Skiorten und anderen Freizeitaktivitäten, wie Restaurants oder Sehenswürdigkeiten gemacht. 
Die Plattform monetarisiert die getätigten Buchungen bei den Partnerunternehmen, wobei dem Endkunden keine zusätzlichen Kosten entstehen, sondern dieser nur die Vorteile der Plattform, wie leichte Planbarkeit, Übersichtlichkeit der Angebote, Vergleichen von Angeboten und anschließend die direkte Buchung hat. Damit verlagert man den Schwerpunkt des Wertaustausches vom Endkunden hin zum Plattformanbieter, was die Nachhaltigkeit der Plattform unterstreicht.
Ein großer Vorteil ist, wie leicht es dem Planer des Ausfluges gemacht wird, viele Wünsche zu vereinen und damit einen zufriedenstellenden Urlaub für alle Mitfahrenden zu planen. Eine große Herausforderung der Plattform AlpUs wird sein, dass es schnell zu einer gewissen Größe von Partnern heranwachsen muss, um für den Großteil der Skifahrer interessant zu werden. Hier sehe ich eine große Herausforderung, da dies viel Überzeugungsarbeit bei den lokalen Partnerrestaurants, hotels, Skigebieten, Öffis bedarf. 
Eine weitere Idee zur Fortentwicklung der Plattform AlpUS wäre, die Plattform nicht nur für Ski Reisen zu öffnen sondern auch für andere Tourismusarten in den Bergen oder generell für Tourismus. Sozusagen ein online Reisebüro, welches einem hilft den Trip holistisch zu planen. 
Zudem sollte das gezeigte Werbevideo überarbeitet werden und nicht nur rational an den Kunden heran treten, sondern auf die emotionale Ebene des Urlaubs abzielen und wie viel einfacher die Planung wird und dadurch der Spaß im Urlaub maximiert. Eine nicht so monotone Stimme und etwas Musik gepaart mit Bildern wären nicht schädlich. Generell sollte der Werbeauftritt sehr gut gepflegt sein, um mit Konkurrenten wie Airbnb und Booking.com mithalten zu können. Zu erst könnten die Zielgruppen als technisch bewusste Skifahrer definiert werden.   
",1686060089.0,APPROVED,2023-06-06T13:24:57.804000Z,2023-06-06T14:06:25.760000Z,2023-06-08T09:55:09.835000,2023-06-06T14:06:26.333346Z,2488.0,C4FP4UXH,200.0,"English, German",Undergraduate degree (BA/BSc/other),26.0,Male,White,Germany,Germany,Germany,German,Yes,Full-Time,
55,69.0,G2,"<font style=""vertical-align: inherit;""><font style=""vertical-align: inherit;""><font style=""vertical-align: inherit;""><font style=""vertical-align: inherit;"">In diesem Peer Review beschreibe ich das Geschäftsmodell von (TravelNow). </font></font><font style=""vertical-align: inherit;""><font style=""vertical-align: inherit;""><font style=""vertical-align: inherit;"">Der Zweck dieser Überprüfung besteht darin, die verschiedenen Komponenten des Geschäftsmodells kritisch zu analysieren, seine Wirksamkeit bei der Erreichung der Unternehmensziele zu bewerten und Empfehlungen für Verbesserungen auszusprechen. </font></font><font style=""vertical-align: inherit;""><font style=""vertical-align: inherit;""><font style=""vertical-align: inherit;"">Stärken: Einzigartiges Wertversprechen: Das Geschäftsmodell kommuniziert effektiv das einzigartige Wertversprechen von (TravelNow). </font></font><font style=""vertical-align: inherit;""><font style=""vertical-align: inherit;""><font style=""vertical-align: inherit;"">Es identifiziert klar die wesentlichen Vorteile und Wettbewerbsvorteile, die das Unternehmen von seinen Mitbewerbern unterscheiden. </font></font><font style=""vertical-align: inherit;""><font style=""vertical-align: inherit;""><font style=""vertical-align: inherit;"">Dies ist entscheidend für die Gewinnung und Bindung von Kunden auf einem überfüllten Markt. </font></font><font style=""vertical-align: inherit;""><font style=""vertical-align: inherit;""><font style=""vertical-align: inherit;"">Umsatzgenerierung: Das Geschäftsmodell zeigt einen umfassenden Ansatz zur Umsatzgenerierung. </font></font><font style=""vertical-align: inherit;""><font style=""vertical-align: inherit;""><font style=""vertical-align: inherit;"">Es identifiziert mehrere potenzielle Einnahmequellen, wie zum Beispiel: </font></font><font style=""vertical-align: inherit;""><font style=""vertical-align: inherit;""><font style=""vertical-align: inherit;"">Dies spiegelt einen diversifizierten und nachhaltigen Ansatz für das finanzielle Wohlergehen des Unternehmens wider. </font></font><font style=""vertical-align: inherit;""><font style=""vertical-align: inherit;""><font style=""vertical-align: inherit;"">Schauchen: Wettbewerbsanalyse: Dem Geschäftsmodell fehlt eine umfassende Analyse der Wettbewerbslandschaft. </font></font><font style=""vertical-align: inherit;""><font style=""vertical-align: inherit;""><font style=""vertical-align: inherit;"">Es ist wichtig, eine gründliche Bewertung der wichtigsten Wettbewerber, ihrer Stärken, Schwächen und Marktpositionierung durchzuführen. </font></font><font style=""vertical-align: inherit;""><font style=""vertical-align: inherit;""><font style=""vertical-align: inherit;"">Diese Analyse wird (TravelNow) dabei helfen, Möglichkeiten zur Differenzierung zu erkennen und potenzielle Bedrohungen für seinen Erfolg zu verstehen. </font></font><font style=""vertical-align: inherit;""><font style=""vertical-align: inherit;""><font style=""vertical-align: inherit;"">Kostenstruktur und Finanzprognosen: Das Geschäftsmodell bietet begrenzte Informationen zur Kostenstruktur und Finanzprognosen. </font></font><font style=""vertical-align: inherit;""><font style=""vertical-align: inherit;""><font style=""vertical-align: inherit;"">Es ist wichtig, detaillierte Finanzprognosen einzubeziehen, einschließlich erwarteter Ausgaben, Umsatzprognosen und Rentabilitätsschätzungen. </font><font style=""vertical-align: inherit;"">Das wird helfen </font></font><font style=""vertical-align: inherit;""><font style=""vertical-align: inherit;""><font style=""vertical-align: inherit;"">beurteilen Sie die finanzielle Tragfähigkeit des Modells und treffen Sie fundierte Entscheidungen. </font></font><font style=""vertical-align: inherit;""><font style=""vertical-align: inherit;""><font style=""vertical-align: inherit;"">Verbesserungsvorschlag: Führen Sie eine umfassende Wettbewerbsanalyse durch: Eine gründliche Analyse der Wettbewerbslandschaft ist notwendig. </font></font><font style=""vertical-align: inherit;"">Identify key competitors, their strengths, weaknesses and market positioning. Diese analyse wird bei der entwicklung wirksamer differenzierungsstrat egien und der erfolgreichen positionnierung von hilfreich sein.</font style=""vertical-align: inherit;""></font style=""vertical-align: inherit;""></font style=""vertical-align: inherit;""></font style=""vertical-align: inherit;""></font style=""vertical-align: inherit;""></font style=""vertical-align: inherit;""></font style=""vertical-align: inherit;""></font style=""vertical-align: inherit;""></font style=""vertical-align: inherit;""></font style=""vertical-align: inherit;""></font style=""vertical-align: inherit;""></font style=""vertical-align: inherit;""></font style=""vertical-align: inherit;""></font style=""vertical-align: inherit;""></font style=""vertical-align: inherit;""></font style=""vertical-align: inherit;""></font style=""vertical-align: inherit;"">
",1686060180.0,APPROVED,2023-06-06T13:08:54.158000Z,2023-06-06T14:06:59.160000Z,2023-06-08T09:55:13.412000,2023-06-06T14:07:00.151128Z,3486.0,C4FP4UXH,807.0,"English, Greek, German, Spanish, French",Graduate degree (MA/MSc/MPhil/other),26.0,Female,White,Greece,Greece,Greece,Greek,Yes,Full-Time,
56,121.0,G2,"Alp us hilft bei der Organisation einer Reise, z.B. bei der Planung einer Skireise in Form einer Gruppe, da es alle für eine Reise benötigten Informationen auf einer einzigen Plattform zeigt, und dass Sie die Informationen über den Ort, Informationen über die Route, um den Ort mit anderen Transportmitteln zu erreichen, und geben Sie Vorschläge individuell für jedes Mitglied der Gruppe, um den Buchungsprozess des Skigebiets und der Unterkunft und Gastronomie zu erleichtern. Die App verbindet verschiedene Buchungsfunktionen für Skigebiete, Hotelreservierungen und Transportreservierungen, um einen Umsatz für die Plattform zu generieren. Das Geschäftsmodell hört sich gut an, ist aber meiner Meinung nach nicht so sehr praktikabel. 
ich würde mir überlegen, wie es laufen könnte, dass die handwerker und händler nicht komplett voneinander getrennt sind. so könnte die konkurrenz weniger sein, sondern sie kann über die plattform ihreEs gibt auch einige Bedenken, die nicht in der App hervorgehoben wird, wie die Echtzeit-Daten des Skigebiets, die Wetterbedingungen, ist es ein Schneefall, und die Karten der Strecke. Es ist auch nicht hervorgehoben, dass die App ein Tracking der Strecke des Berges hat. Diese Funktion kann den Besuchern helfen, Routen zu finden, ohne sich im Gebirge zu verirren. Die App enthält keine Sicherheitsfunktionen wie Notfallkontakte und -warnungen sowie Informationen über mögliche Risiken.  
Eine weitere Sache, die diese App meiner Meinung nach etwas unpraktisch macht, ist der Internetzugang auf einem Smartphone in diesen abgelegenen Skigebieten. anmerkungen du könntest in deinem verbesserungsvorschlag darauf achten, dass die unpassende benennung vor dem punkt der skier vermieden wird und weitere inhalte/zielgruppen in dieser hinsicht


",1686060291.0,APPROVED,2023-06-06T13:12:00.210000Z,2023-06-06T14:15:24.253000Z,2023-06-08T09:55:07.726000,2023-06-06T14:15:24.708550Z,3805.0,C4FP4UXH,73.0,"German, English",Undergraduate degree (BA/BSc/other),29.0,Male,White,Saudi Arabia,Germany,Pakistan,English,Yes,Part-Time,
57,151.0,G2,"Zuerst einmal kann ich sagen, dass der Pitch zu dem Geschäftsmodell gut strukturiert ist und dadurch klar ersichtlich ist, was der Sinn des gepitchten Unternehmens sein soll. Allerdings sind in den kurzen 3 Minuten noch einige spezifischere Fragen für mich offen geblieben, was aber natürlich bei einem so kurzen Anriss des Geschäftsmodells nicht zu vermeiden ist. Mit ein bisschen mehr Aufwand könnte dieses vielleicht besser visualisiert werden mit Hilfe von Videosequenzen und Tabellen. 
Beispielsweise wird mir nicht ganz klar, was der Vorteil für Serviceprovider wie zum Beispiel Airbnb ist, die auch jetzt schon keine Probleme haben ihre Zimmer, Ferienwohnungen und sonstiges zu vermieten. Wieso sollten diese den Service unterstützen und einen Teil ihrer Einnahmen abgeben? Für mich wirkt das Produkt in einer gewissen Weise auch wie ein Konkurrenzprodukt für entsprechende Serviceanbieter. Für mich sollte deshalb deutlicher herausgestellt werden, was der Vorteil für die Partner wäre. Dabei geht es mir nicht um kleine Firmen und Veranstalter, sondern um die großen Serviceprovider mit teilweise eigenen Apps und Vertriebswegen. Durch die App wird der Service einer Marke angeboten und durch die eigenen Services wird der Markt überschwemmt.

Andererseits kann ich sagen, dass ich die Grundidee, die mehreren Aspekte eines Urlaubs in den Alpen (Ski- oder Wanderreise beispielsweise) zu kombinieren und es dem Urlauber dadurch einfacher zu machen seine Reise zu planen, gut finde. Ich kann mir vorstellen, dass es dafür eine spezifische Zielgruppe gibt, die froh wäre, wenn sie ihren Urlaub über eine zentrale Stelle planen könnte. Ich würde empfehlen, eine Social-Media Umfrage einzubringen, in dem der Anteil der Personen ermittelt wird, welche daran interessiert sind, eine derartige App zu nutzen. Dadurch kann ermittelt werden, ob diese Zielgruppe überhaupt existiert oder ob die bestehenden Möglichkeiten für Urlauber ausreichend sind und die Entwicklung einer App dadurch unrentabel erscheint. 
Alles in Allem finde ich die Idee und den Pitch interessant, allerdings bin ich mir nicht sicher, ob die Zielgruppe dafür existiert und ob bestehende Quasi-Monopolisten überhaupt Interesse an einer Kooperation hätten, ohne die die ganze App natürlich ihre Daseinsberechtigung verlieren würde.

",1686060481.0,APPROVED,2023-06-06T13:31:40.267000Z,2023-06-06T14:15:59.186000Z,2023-06-08T09:55:10.017000,2023-06-06T14:15:59.681059Z,2659.0,C4FP4UXH,12.0,"English, German",High school diploma/A-levels,24.0,Male,White,Germany,Germany,Germany,German,Yes,Part-Time,
58,108.0,G2,"Beginnend, kann ich feststellen dass der business-model pitch von Alp-Us im großen und ganzen überaus gelungen ist. Zum einen waren in der Struktur alle wichtigen Aspekte der App inbegriffen, zum andren war die präsentation an sich überwiegend ruhig und professionell. Dennoch wird der Pitch im folgenden genauer Analysiert, hinsichtlich der Stärken und Schwächen und möglichen Verbesserungen.
Positiv aufgefallen ist die transparente Darstellung des Geschäftsmodells, die das Konzept trotz der knappen Zeit erfolgreich überbringen konnte. Hinsichtlich des Inhalts fiel mir die Buchung von kombinierbaren Modulen als besonders benutzerfreundlich auf.
Darüber hinaus ist die App als sehr kundenfreundlich anzusehen und passend für potentielle Zielgruppen des beschriebenen Geschäftsmodells. Ebenfalls wird sich die Entscheidung mit Partnerunternehmen zu kooperieren  auszahlen, wie ähnliche erfolgreiche Applikationen bereits zeigen.
Zusammenfassend kann man sagen, dass das Alp-Us Business Konzept an sich enormes potential verbirgt. Einige gute Vorraussetzungen, wie leichte Zugänglichkeit durch die mobile Nutzung und kombinierbare Vorschläge, bilden bereits eine hervorragende Grundlage für ein wachsendes Unternehmen. Jedoch, befinden sich in dem aktuellen Modell auch noch einige Schwachstellen an denen gearbeitet werden sollte für einen erfolgreichen Werdegang.
Zum einen kann hierbei der Punkt angestrebt werden, dass sich Alp-Us eine breitere Basis auf dem Markt schafft. Da der strikte Fokus auf Wintersport das Unternehmenswachstum und das maximale Wachstum enorm deckelt. Hinsichtlich des erläuterten Konzepts sollte es durchaus möglich sein die angesprochene Zielgruppe mit überschaubaren Ressourcen maßgeblich auszuweiten.
Weiterhin, wurden manche wenige Punkte nicht verständlich genug kommuniziert. Beispielsweise ist mir unklar, was der Sprecher mit ""je mehr Teilleistungen gebucht werden, desto mehr Gebühren wird an die Plattform zurückfließen"" im Kontext meinte.
Falls das vorangehende Zitat bedeutet, dass mehr Gebühren anfallen bei größeren Buchungen bzw. ein Kunde mehrere Module bei Alp-Us bucht, dann sollte das Gebührenmodell erheblich angepasst werden. Denn sonst erzielt die Regelung dass Kunden lieber auf Teilleistungen verzichten und diese dann bei Konkurrierenden Anbietern buchen.
Schlussendlich,hinsichtlich der Schwachstellen, würde ich anmerken, dass sich der Kunde noch entscheiden muss auf welche Seite er auch steht, sei es aus Gründen der user requirements.
",1686060522.0,APPROVED,2023-06-06T13:10:32.635000Z,2023-06-06T14:19:28.186000Z,2023-06-08T09:55:13.592000,2023-06-06T14:19:29.121876Z,4136.0,C4FP4UXH,172.0,"English, German",High school diploma/A-levels,21.0,Female,White,Germany,Netherlands,Germany,German,DATA_EXPIRED,DATA_EXPIRED,
59,79.0,G2,"Teilen Sie meine Gedanken zu den Potenzialen, Schwachen un Verbesserungsvorschlagen. 
Starken. Alp-Us hat groses Versprechen mit seiner geplanten benutzerfreundlichen Schnittstelle. Ich stelle mir ein nahtloses Erlebnis vor, bei dem die Nutzer problemlos durch die App navigieren konnen, wodurch der Plannungsprozess eines Skiurlaubs fur Gruppen eine Brise wird. Alp-Us will mit seinen umfassenden Merkmalen wie Unterkunftsbuchungen, Speisespasse und Skifahrten eine zentrale Losung fur alle Bedurfnisse der Gruppenreiseorganisation sein.
Zudem ist die Betonung gruppenbezogener Fahigkeiten durch Alp-Us lobenswert. Die App ermoglicht es Gruppenmitgliedern, zusammenzuarbeiten, Praferenzen auszutauschen und sogar uber Aktivitaten abzustimmen und so die nahtlose Kommunikation und Entscheidungsfindung innerhalb der Gruppe zu fordern. Dieser gemeinsame Ansatz fordert das Zusammenspiel und stellt sicher, dass die Meinungen un Wunsche aller im Planungprozess berucksichtigt werden. 
Schwachen. Alp-Us weist groses Potenzial auf, aber es ist wichtig, die Herausforderungen anzuerkennen, vor denen Alp-Us steht. Verbesserungswurdig ist auch die Zielerfassung der App. Um an ein breiteres Publikum zu appellieren, sollte Alp-Us erwagen, seine Datenbank um eine umfassendere Auswahl beliebter Ski-Resorts zu erweitern. Dies wurde den Nutzern eine breitere Palette von Optionen bei der Planung ihrer Skiferien bieten.
Ein weiterer Aspekt, der von einer Weiterentwicklung profitieren konnte, ist die Personalisierung. Durch masgeschneiderte Empfehlungen auf der Grundlage individueller Praferenzen, Kompetenzniveaus und Ernahrungsbedurfnisse konnte Alp-Us fur jeden Nutzer eine individuellere Erfahrung anbieten. Diese personliche Beruhrung wurde nicht nur die Zufriedenheit der Nutzer erhohen, sondern auch zu einer angenehmeren und masgeschneiderten Reise beitragen.
Verbesserungsvorschlage. Um die Alp-Us App weiter zu starken, ware eine Integration in Skipasanbieter von Vorteil. Alp-Us wurde dadurch, dass es den Nutzern erlaubt, ihre Ski-Passe direkt uber die App zu erwerben un zu verwalten, den Bedarf an physischen Tickets oder separaten Buchungen beseitigen und so die Skifahrerfahrung noch weiter vereinfachen.

",1686060698.0,APPROVED,2023-06-06T13:13:53.121000Z,2023-06-06T14:17:20.359000Z,2023-06-08T09:55:07.132000,2023-06-06T14:17:23.578908Z,3808.0,C4FP4UXH,327.0,"English, Latvian, German, Russian",High school diploma/A-levels,20.0,Male,White,Estonia,Latvia,Latvia,Latvian,Yes,Due to start a new job within the next month,
60,127.0,G2,"Zum Anfang das Positive: Es ist eine gute Idee alle Buchungsfaktoren in einen Anbieter zu vereinen. Dies ermöglicht anscheinend eine leichte Art der Buchung. Vor allem wenn das System der Einladungen gut implementiert ist, sehe ich dort eine große Vereinfachung des Buchungsprozesses. Vor allem für Jugendgruppen und Firmen bietet das eine sehr gute Möglichkeit. Bei genügend Usern ist das Review System außerdem ein sehr willkommenes Feature. Später könnte man dementsprechend noch mehr Features anbieten, wie zum Beispiel die Buchung von weiteren Gruppenaktivitäten, wie zum Beispiel Konzerte oder Museen oder ähnliches.  Außerdem sollte man eventuell Räume für Firmenmeetings oder ähnliches mit Anbieten um hier das Buchen darüber für Firmen attraktiver zu machen.
Nun ein paar negative Faktoren die mir aufgefallen sind: Zum einen ist aus dem System nicht erkennbar wodurch der Service Geld verdient. Ohne dieses ist der Service nicht sustainable. Wenn aber eine Provision verlangt wird, dann könnte das den Service wiederum unattraktiv für private Konsumenten machen. Geld von den anderen Anbietern, wie Hotels und Gastronomie zu verlangen ist auch keine gute Option, da dies die Seite unattraktiv für diese machen könnte. Eine weitere Möglichkeit wäre, dass man die Kundendaten verkauft, was aber Datenschutztechnisch schwierig sein könnte. Allerdings muss dies insgesamt genauer ausformuliert und durchdacht werden. --&gt;hier sollte man den Fokus auf ein paar Kernaspekte setzen und demnach entscheiden.
Am ende kommt es vor allem auf die Vielfalt der Features und die Usability des Produktes an. Nur wenn genug User den Service nutzen ergibt das gesamte Review System Sinn. Gastronomen und Hotels haben keinen wirklichen Grund sich auf der Plattform zu bewerben, wenn keine entsprechende Userbase vorhanden ist. Dafür muss man aber die Plattform insgesamt ins Rollen bringen. Wenn diese einmal läuft und Rentabel für die Betreiber ist, dann sehe ich dort die Möglichkeit für eine gute Website für die Buchung einer Reise.  
",1686061273.0,APPROVED,2023-06-06T13:35:30.670000Z,2023-06-06T14:26:56.836000Z,2023-06-08T09:55:10.207000,2023-06-06T14:26:57.381575Z,3087.0,C4FP4UXH,62.0,"English, German",Undergraduate degree (BA/BSc/other),22.0,Male,White,Germany,Germany,Germany,German,Yes,Part-Time,
61,92.0,G2,"Zu Beginn kann man sagen, dass das Geschäftsmodell des Unternehmens ein realistisches Szenario im Bereich des Wintersports mit guten Gewinnaussichten gefunden hat: Es gibt immer mehr Menschen mit zunehmender Interesse an Wintersport. Die Marke Alp-Ups ist zudem eine Marke, die bewusst mit dem Ziel eingetragen werden sollte, den Wintersport Breiten Leuten zugänglich zu machen. Gute Idee mit einem Wertfluss: Heutzutage gibt es viele Ideen und Software kann man schlecht ohne Firma bauen.
Gut gelungen ist ebenso der Entwurf für die Entwicklung der App: Alle Teilnehmer sowie der Gruppenleiter können im Smartphone die Information rund um die geplante Reise abrufen. Die Zusammenarbeit mit Reisebüros sollte deshalb deshalb ausgebaut werden. Die Zielgruppenerweiterung sollte noch deutlicher beschrieben werden. Dazu gehören: Ausbau der Kooperationskanäle: Kooperation mit Reisebüro und Dienstleistern in den Urlaubsregionen, also in den Bereichen Transport, Skigebiet, Gastronomie sowie der Unterkunft
Ein nicht genau erläuterter Aspekt ist die fehlende Transparenz für einerseits den Kunden und den Dienstleistern. Auch wenn die Grundversorgung nicht für alle Skifahrer gleichermaßen vorhanden ist, würde ich im Interesse der Transparenz durch eine faire Darstellung der Alternativen über die App wünschen. Ebenso sollen alle Dienstleister eine faire Möglichkeit für die Plazierung ihres Angebots erhalten, gerade im Hinblick auf die Möglichkeit der bezahlten Plazierung.
Ebenfalls wurde in der Vorstellung des Geschäftsmodells nicht ausreichend auf die Methoden zur Steigerung der Akzeptanz aufgegriffen. Skifahrern müssen eventuell durch gute Anreize bewegt werden und auf den Mehrwert der App aufmerksam werden. Den Dienstleistern in Skigebieten müssen das Potential der Umssatzsteigerung in dieser App verständlich sein.
Alles in allem ist der Vertrieb gut ausgedacht, im Bereich der Public Relations für die Skifahrer und für die Dienstleistern sollte noch etwas ausgearbeitet werden.
",1686061492.0,APPROVED,2023-06-06T13:39:35.564000Z,2023-06-06T14:30:36.382000Z,2023-06-08T09:55:10.387000,2023-06-06T14:30:37.093463Z,3061.0,C4FP4UXH,404.0,"Chinese, English, German, Cantonese, Mandarin",Undergraduate degree (BA/BSc/other),25.0,Male,Asian,China,DATA_EXPIRED,DATA_EXPIRED,Chinese,Yes,Part-Time,
62,117.0,G2,"Das Geschäftsmodell von Alp-Us bezieht sich auf eine sehr spezifische Target-Group. Dabei ist zu berücksichtigen, dass es sich bei Skiurlauben durchaus um eine breite Sparte in der Tourismusbrache handelt, die entsprechend einen ausreichenden Kreis an potentiellen Usern erreichen könnte. Die Entwickler sollten aber darüber nachdenken, das Modell jedenfalls auf andere Urlaube in den gleichen Gebieten zu erweitern, um den Kreis der Angesprochenen zu vergrößern.
Ein potentielles Problem könnte in der Konzeption der Buchung zu finden sein. Hier bietet die App die Möglichkeit, Buchungen durch den Gruppenleiter vornehmen zu lassen. Dabei stellt sich die Problematik, dass Gruppenmitglieder verpflichtet werden könnten, ohne explizit zugestimmt zu haben. Es müssten jedenfalls Sicherungsmechanismen eingebaut werden, die eine vorherige Zustimmung der Mitglieder in der App anfordern, bevor eine Buchung durchgeführt werden kann. 
Nicht deutlich wurde anhand des Vorstellungsvideos, ob eine Kommunikation innerhalb der App möglich ist. Dies ist ein Feature, welchen jedenfalls sinnvoll erscheint, sollte es bereits vorhanden bzw. angedacht sein, aber auch beworben werden sollte. 
Dem Endkunden sollten die Vorteile der App deutlich vor Augen geführt werden. Die Vereinfachung der gesamten Planung und Buchung ist der Hauptaspekt der App, daher sollte dem Kunden gezeigt werden, dass die gesamte Planung nur über eine Anwendung möglich ist und keine weiteren Plattformen herangezogen werden müssen, auch nicht für die Kommunikation. Dazu sollte es auch möglich sein - hier geht ebenfalls aus dem Video nicht hervor, ob dies bereits möglich bzw. angedacht ist - Angebote mit den anderen Gruppenmitgliedern zu teilen und bspw. Abstimmungen vornehmen zu lassen. 
Letztendlich sollte der Anbieter noch deutlicher herausstellen, was der konkrete Vorteil seiner Anwendung ist, da es eine Fülle von Buchungsplattformen, die auch verschiedene Angebote wie Transport und Unterkünfte bieten, am Markt gibt, mit denen der Anbieter konkurrieren würde. 
Ein Vorteil, der sich bei der Etablierung bietet ist, dass für die Dienstleister kosten erst bei Buchung entstehen. Der Anbieter sollte allerdings noch transparent gestalten, wie Stornierungen etc. erfolgen und sich über die Regelungen zur Pauschalreisen im Klaren sein, die ggf. Haftungsrisiken bergen.
",1686062386.0,APPROVED,2023-06-06T14:01:00.525000Z,2023-06-06T14:44:52.353000Z,2023-06-08T09:55:14.352000,2023-06-06T14:44:53.209503Z,2632.0,C4FP4UXH,161.0,"English, German",Graduate degree (MA/MSc/MPhil/other),25.0,Female,White,Germany,Germany,Germany,German,No,Part-Time,
