21,92.0,G1,"Der Bereich des Wintersports hat sich in den vergangenen Jahren durch die größere Beliebtheit eine zunehmende Nachfrage verzeichnet. Angesicht des Trends sind jedoch die vielfältigen Aspekte der Freizeitaktivitäten für die meisten Interessenten sehr überwältigend: Die Vielzahl an Angeboten für Skigebiete, Transportmöglichkeiten, Verpflegungen und Unterkünfte müssten für eine gelungenen Ausflug in der Freizeit mühsam in Einklang begracht werden, was eine ernorme Belastung für alle Teilnehmer bedeutet. Dieses Problem möchtet sich das Startup Unternehmen durch das Tool ""Alp-Us"", ein innovatives Hilfswerkzeug mit Methoden der modernen Technologie lösen. Kernpunkt des Tools ist eine für das Smartphone konzipierte und implementierte App, auf welches jeder Teilnehmer des Ausflugs über das eigene Smartphone zugreifen kann. Alle Teilnehmer, darunter auch der Gruppenleiter, registrieren sich auf der Plattform über einen Einladungslink und treten dort einer virtuellen Gruppe bei. Hier erhalten sie Information rund um den gewünschten Ausflug in Echtzeit wie beispielsweise die Verfügbarkeit des Skigebiets oder die Verkehrssituation und können so die Planung optimieren. Anstatt die Buchungen für den Ausflug über traditionellen, fragmentierten Hilfsmitteln, verteilt auf mehreren Dienstleistungsanbietern zu buchen, kann der Gruppenleiter mit den vielfältigen Vorschlägen von Alp-Ups und die modulare Planungseinheiten für Skigebiete, Transportmöglichkeiten, Verpflegung und Unterkünfte eine höhere Planungssicherheit erreichen. Mit diesem gelungenen Konzept füllt das Unternehmen eine bisher nicht bedientes Marktsegement, das in Zukunft weiter wachsen wird. Mit der Spiezialisierung des Unternehmens auf die Vermittlung von Dienstleistern für den Wintrersport bildet Alp-Ups auch eine wichtige Bindung zwischen dem Kunden sowie den Anbieter der Dienstleistung, welche beide Parteien zugute kommt und gleichzeitig eine Opportunität für Gewinnerzielung bietet. Die Akzeptanz des Konzepts seitens der Kunden sowie der Dienstleistern soll daher weiter geprüft und verbessert werden.
",1686051029.0,APPROVED,2023-06-06T10:34:35.794000Z,2023-06-06T11:31:36.142000Z,2023-06-06T11:31:36.633000,2023-06-06T11:31:36.562666Z,3421.0,C4FP4UXH,401.0,"Chinese, English, German, Cantonese, Mandarin",Undergraduate degree (BA/BSc/other),25.0,Male,Asian,China,DATA_EXPIRED,DATA_EXPIRED,Chinese,Yes,Part-Time,2023-06-06T11:30:29.000000Z
22,83.0,G1,"Das Geschäft von Alp-Us besteht in der Entwicklung einer personalisierten Smartphone-Applikation, mi der Kunden (ob Familien, Freunde oder Unternehmen) Skiausflüge einfach und ohne Zeitverlust organisieren können, und zwar solche, die am besten auf ihren Geschmack abgestimmt sind. Insgesamt hat die Anwendung aufgrund der zunehmenden Nutzung von Smartphones eine großes Erfolgspotenzial. Sie bietet ein sehr nützliches Hilfsmittel für ein sehr beliebtes und gefragtes Erlebnis. Außerdem ist sie jederzeit und von überall aus ohne langes Suchen abrufbar. Es ist extrem personalisiert und ideal für die heutige Zeit, in der Zeit buchstäblich Geld ist. Das macht es zu einer perfekten Gelegenheit für Teambuilding-Aktivitäten für Unternehmen, die nicht so viel Zeit zur Verfugung haben. Auch für Tourismusunternehmen ist es von Vorteil, spezialisierte Kunden zu haben, damit sie ein gutes Preis-Leistungs-Verhältnis bieten und Enttäuschungen und negative Kritik vermeiden konnen - denn ein personalisierter Service vermeidet jede Unzufriedenheit. Das Geschäft ware perfekt, wenn das Unternehmen die Möglichkeit hatte, den Service auch über andere Plattformen und persönlich zu erbringen, um zu vermeiden, dass einige Leute keinen Zugang dazu haben oder dass bei Problemen mit der Anwendung Hindernisse entstehen. Um keine Kunden und kein Geld zu verlieren, ist es wichtig, dass die Anwendung gut funktioniert. Und bewerten Sie di Kosten, die mit der Erstellung einer guten Anwendung mit einem großartigen Ui/Ux-Design verbunden sind. Im Allgemeinen halte ich es fur ein großartiges Geschäft fur Investitionen und einer sehr innovative Gelegenheit fur viele Investoren. Heutzutage wird die Welt immer digitaler, und die Menschen ziehen es vor, alles in einer Minute in ihren Händen zu haben. Das Wachstumspotenzial dieses Unternehmens ist riesig, und mil Hilfer guter Investoren konnten wir ein Unternehmen in Millionenhöhe entstehen sehen. Es ist wichtig, dass sie die besten Manager und Investoren haben, um ein aussergewöhnliches Team zu bilden, und wir werden eines der besten Unternehmen auf dem Markt sehen.
",1686051280.0,APPROVED,2023-06-06T10:49:47.604000Z,2023-06-06T11:36:21.331000Z,2023-06-06T11:36:21.854000,2023-06-06T11:36:21.771176Z,2794.0,C4FP4UXH,204.0,"German, Portuguese, Spanish, Russian, Italian",Graduate degree (MA/MSc/MPhil/other),24.0,Female,White,Portugal,Portugal,Portugal,Portuguese,Yes,Part-Time,2023-06-06T11:34:40.000000Z
23,91.0,G1,"Ich denke, dass das Geschäftsmodell von Alp-Us insgesamt recht innovativ und überzeugend ist. Dennoch hat es auch einige negative Aspekte, die ich im Folgenden aufzählen werde. Einer der Hauptvorteile der App ist, dass sie sich mit allen Arten von Reisen befasst, sowohl mit denen mit Freunden oder der Familie, als auch mit Geschäftsreisen. Ein weiterer Vorteil ist die Möglichkeit, Einladungslinks zu versenden, mit denen sich verschiedene Gruppenteilnehmer schnell und einfach anmelden können. Ein weiterer Grund, warum Alp-Us beliebt ist, ist die Tatsache, dass es sich um alle Aspekte des Erlebnisse kümmert, so dass Transport, Erlebnisse und Gastronomie in der App gebucht werden können. Einer der Hauptnachteile des Geschäftsmodelle ist die Ausschließliche Bindung an die Erfahrungen, die man in den Bergen machen kann. Um konkurrenzfähiger zu sein, sollten auch andere Gebiete und Erlebnisse angeboten werden, zum Beispiel am Meer oder auf dem Land. Ein weiterer Aspekt, den Alp-Us berücksichtigen sollte, ist die Konkurrenz durch Apps und Websites, die ähnliche Dienste anbieten: Um sein Geschäft auszubauen, muss es dem Unternehmen gelingen, diesen Markanteile abzunehmen. Ein Ratschlag, den ich den Machern der App geben kann, ist, sie so zu bewerben, dass sie bei Menschen bekannt wird, die an der Nutzung ihrer Dienste interessiert sein könnten, bekannt wird. Diese Werbung sollte gezielt erfolgen, zum Beispiel durch die Zusammenarbeit mit Brands oder Instagram-Seiten, die mit der Welt der Berge oder des Skifahrens zu tun haben. Zusammenfassend kann meiner Meinung nach als ein effektiver und innovativer Dienst betrachtet werden, der für alle Menschen, die gerne reisen und die Berge erleben, sehr nützlich ist.
",1686051549.0,APPROVED,2023-06-06T10:09:28.113000Z,2023-06-06T11:13:49.987000Z,2023-06-08T09:57:07.845000,2023-06-06T11:13:50.965198Z,3862.0,NOCODE,520.0,"Chinese, English, German, Italian, Mandarin, Spanish, Russian, Portuguese, Norwegian, Swedish, Japanese, French, Dutch, Danish",High school diploma/A-levels,27.0,Male,White,Italy,Italy,Italy,Italian,Yes,Part-Time,2023-06-06T11:39:09.000000Z
24,74.0,G1,"Alp-Us ist eine innovative Anwendung zur Organisation organisierter Skiurlaube für viele Personen in einer Gruppe, z.B. für Großfamilien oder eine Gruppe von Freunden.

Was mir an der Anwendung gefällt, ist, dass eine solche virtuelle Gruppe dank der Einladungen, die der Veranstalter über Links an einzelne Mitglieder einer solchen Gruppe sendet, sehr schnell (sogar in wenigen Minuten) erstellt werden kann, was sicherlich dazu beitragen wird, Menschen für die Anwendung zu gewinnen .

Alp-Us erstellt kombinierbare Vorschläge hinsichtlich Skigebieten, Unterkünften, Gastronomie und Transport zu und von Ihrem Aufenthaltsort. Meiner Meinung nach werden die richtigen Vorschläge, die den Teilnehmern präsentiert werden, über den Erfolg der Bewerbung entscheiden, da dies praktisch der schwierigste Teil bei der Organisation einer organisierten Reise ist und viele Menschen Probleme damit haben, diese 4 Elemente auszuwählen, um eine gute Verbindung zwischen ihnen herzustellen, aber Die Idee an sich ist sehr gut, allerdings kann die Umsetzung deutlich schwieriger und gleichzeitig zeitaufwändig und vor allem kostspielig für ein solches Unternehmen in der Entstehungsphase sein.

Alp-Us ermöglicht zudem die Buchung einzelner Abschnitte einer Abfahrt ganz einfach mobil, was nahezu jederzeit mühelos möglich ist, was den Kunden die Buchung so einfach wie möglich machen soll.

Die Alp-Us-Anwendung funktioniert auch mit zwei Hotelunternehmen wie Airbnb und ebookers.ch, was meiner Meinung nach angesichts der Beliebtheit anderer Websites, z. B. booking.com, für einige Benutzer möglicherweise nicht ausreicht. Darüber hinaus kooperiert es auch mit Unternehmen, die für Skipisten und Transport zuständig sind. Ich glaube, dass die Zusammenarbeit in Zukunft auch auf andere Unternehmen ausgeweitet werden sollte, um den Kunden, die aus einer breiten Palette von Angeboten auf dem Markt ausgewählt werden, möglichst niedrige Preise anzubieten.

Zusammenfassend lässt sich sagen, dass die Gliederung des Alp-U-Antrags eine gute Grundlage für ein erfolgreiches Unternehmen darstellt, aber es bedarf einer Feinabstimmung der Details sowie eines großen Zeit- und Geldaufwands, damit er erstellt und bewiesen werden kann erfolgreich auf dem Freizeitmarkt.
",1686052843.0,APPROVED,2023-06-06T11:35:12.803000Z,2023-06-06T12:03:48.801000Z,2023-06-06T12:03:49.370000,2023-06-06T12:03:49.294826Z,1716.0,C4FP4UXH,325.0,"Polish, German, English, Dutch",Graduate degree (MA/MSc/MPhil/other),21.0,Male,White,Poland,Poland,Poland,Polish,No,Full-Time,2023-06-06T12:00:43.000000Z
25,84.0,G1,"Ich schatze es, dass es eine hauptperson gibt, welche als Leuter fungiert, so ist alles in einer Hand und diese Person kann, dann die Buchungenkoordinieren. Zusätzlich finde ich das feature gut, das jede person seine präferenzen direkt angeben kann und so kann die hauptperson die entscheidung besser fällen. Es ist jedoch wichtig sicherzustellen, dass der gruppenleiter die einladungen verfolgen kann. das beduetet, es muss sehen können, ob eine person sich über den bereitgestellen link angemeldet at und welche personen dies nicht getan haben. Dadurch kann er ein gespräch initiieren, um das problem mit der anmeldung zu klären und zu beheben. Ein weiterer vorteil ist, dass dassystem in bausteinen aufgebaut ist. Dadurch habe ich als urlaub geher, die volle freuheit, wie ich meinen urlaub verbringen möchte. jeder einzelne kann auch individuelle wünsche erfüllen lassen und muss nicht alles spontan entscheiden, sobald er am urlaubsort angekommen ist. Das problem bei dieser app ist es, dass es sehr aufwendig ist, alle bausteine sich individuell zusammenzustellen, weil es unendlich kombinationen gibt und das führt zu passivität. Da es so viel angebot gibt, muss der user erstmals das komplette anbot, sich anzeigen lassen, damit es weiß, was für attraktionen und angebote die einzelnen bausteine haben. Auch ist es schwer seriöse und nicht seriöse angebote auszumachen. Es muss sichergestellt werden, das ich in der app ein review für jedes in anspruchgenomme angebot machen kann, damit ich andere user davor warnen bzw anpreisen kann. So können die anderen user sich vorher schlau machen, ob das angebot zu ihnen passt oder das preis leistungs verhältniss passt. Allgemein sehe bei diesem geschäftsmodel ein problem, dadurch das diese app ein mittelsman ist, werden die preise dementsprechend angehoben und dadurch wird es sehr unattraktive für andere user, einen urlaub mit den verschiedenen bausteinen in der app zu buchen, daher wird die marge nicht all zu hoch sein.

",1686053496.0,APPROVED,2023-06-06T11:36:00.363000Z,2023-06-06T12:18:23.988000Z,2023-06-06T12:18:25.089000,2023-06-06T12:18:25.002247Z,2544.0,C4FP4UXH,1771.0,"English, German",Graduate degree (MA/MSc/MPhil/other),32.0,Male,White,Russian Federation,Germany,Germany,German,No,Full-Time,2023-06-06T12:11:36.000000Z
26,71.0,G1,,,APPROVED,2023-06-06T09:26:45.037000Z,2023-06-06T10:15:03.352000Z,2023-06-06T10:15:04.141000,2023-06-06T10:15:04.067824Z,2899.0,C4FP4UXH,519.0,"English, French, Polish, Spanish, Ukrainian, German",High school diploma/A-levels,53.0,Female,White,Poland,Poland,Poland,Polish,No,Full-Time,
27,,G1,,,APPROVED,2023-06-06T09:34:22.864000Z,2023-06-06T09:57:43.204000Z,2023-06-06T09:57:43.805000,2023-06-06T09:57:43.716462Z,1401.0,C4FP4UXH,357.0,"English, German, Spanish",Undergraduate degree (BA/BSc/other),25.0,Female,Mixed,Germany,Austria,Germany,German,Yes,Full-Time,
28,,G1,,,APPROVED,2023-06-06T09:40:55.572000Z,2023-06-06T10:01:56.546000Z,2023-06-06T10:01:57.005000,2023-06-06T10:01:56.917481Z,1261.0,C4FP4UXH,285.0,"English, French, German, Spanish",Undergraduate degree (BA/BSc/other),23.0,Male,Other,Mexico,Mexico,Mexico,Spanish,Yes,Full-Time,
29,,G1,,,APPROVED,2023-06-06T09:40:37.586000Z,2023-06-06T10:46:02.870000Z,2023-06-06T10:46:03.491000,2023-06-06T10:46:03.422221Z,3926.0,C4FP4UXH,548.0,"Russian, Polish, German, English",Undergraduate degree (BA/BSc/other),50.0,Female,White,Poland,Poland,Poland,Polish,No,Full-Time,
30,,G1,,,APPROVED,2023-06-06T09:41:37.217000Z,2023-06-06T10:07:48.684000Z,2023-06-06T10:07:49.170000,2023-06-06T10:07:49.081395Z,1572.0,C4FP4UXH,217.0,"Polish, English, German, Italian, French",Undergraduate degree (BA/BSc/other),24.0,Female,White,Poland,Poland,Poland,Polish,Yes,Full-Time,
31,,G1,,,APPROVED,2023-06-06T10:17:00.253000Z,2023-06-06T10:33:47.373000Z,2023-06-06T10:33:47.976000,2023-06-06T10:33:47.903119Z,1008.0,C4FP4UXH,46.0,"English, German",Undergraduate degree (BA/BSc/other),33.0,Female,White,Germany,Germany,Germany,German,No,Part-Time,
32,,G1,,,APPROVED,2023-06-06T10:18:31.374000Z,2023-06-06T10:37:00.167000Z,2023-06-06T10:37:00.592000,2023-06-06T10:37:00.523115Z,1109.0,C4FP4UXH,179.0,"English, French, German",Graduate degree (MA/MSc/MPhil/other),27.0,Female,White,Luxembourg,United Kingdom,Luxembourg,German,No,Full-Time,
33,123.0,G1,,,APPROVED,2023-06-06T10:22:02.770000Z,2023-06-06T10:44:39.284000Z,2023-06-06T10:44:39.824000,2023-06-06T10:44:39.747381Z,1357.0,C4FP4UXH,88.0,"English, German, Spanish",Graduate degree (MA/MSc/MPhil/other),23.0,Male,White,Germany,Germany,Germany,German,No,Full-Time,
34,,G1,,,APPROVED,2023-06-06T10:26:19.534000Z,2023-06-06T11:07:36.380000Z,2023-06-06T11:07:38.350000,2023-06-06T11:07:38.273261Z,2477.0,C4FP4UXH,365.0,"German, English, French",Undergraduate degree (BA/BSc/other),25.0,Male,White,Germany,France,Germany,German,Yes,Part-Time,
35,,G1,,,APPROVED,2023-06-06T10:27:38.940000Z,2023-06-06T10:50:09.065000Z,2023-06-06T10:50:09.537000,2023-06-06T10:50:09.457319Z,1351.0,C4FP4UXH,40.0,"English, German, Hungarian",High school diploma/A-levels,30.0,Male,White,Austria,Austria,Austria,German,No,Full-Time,
36,,G1,,,APPROVED,2023-06-06T10:32:31.824000Z,2023-06-06T10:55:13.547000Z,2023-06-06T10:55:14.038000,2023-06-06T10:55:13.963705Z,1362.0,C4FP4UXH,333.0,"English, German, French",Graduate degree (MA/MSc/MPhil/other),32.0,Male,White,Germany,Germany,Germany,German,No,Full-Time,
37,,G1,,,APPROVED,2023-06-06T10:33:13.206000Z,2023-06-06T10:55:30.734000Z,2023-06-06T10:55:31.506000,2023-06-06T10:55:31.436377Z,1338.0,C4FP4UXH,48.0,"German, English",Graduate degree (MA/MSc/MPhil/other),30.0,Male,White,Germany,Germany,Germany,German,No,Full-Time,
38,,G1,,,APPROVED,2023-06-06T10:37:01.543000Z,2023-06-06T11:00:40.102000Z,2023-06-06T11:00:41.046000Z,2023-06-06T11:00:41.333907Z,1419.0,C4FP4UXH,1135.0,"English, French, German",Graduate degree (MA/MSc/MPhil/other),39.0,Male,White,Germany,Germany,Germany,German,No,Full-Time,
39,102.0,G1,,,APPROVED,2023-06-06T10:35:50.280000Z,2023-06-06T10:55:32.153000Z,2023-06-06T10:55:32.602000,2023-06-06T10:55:32.536033Z,1182.0,C4FP4UXH,103.0,"Italian, English, French, German, Spanish",High school diploma/A-levels,29.0,Male,White,Italy,Italy,Italy,Italian,No,Unemployed (and job seeking),
40,96.0,G2,"Der größte Vorteil einer gegebenen Anwendung ist die Tatsache, dass alles in einer Anwendung erledigt wird, auch mit mehrerenPersonen.Eine Person kann den Registrierungslink an viele andere Personen senden, über den Link können Sie sich registrieren und dabei wird alles klar erklärt und führt uns Schritt für Schritt. Die Anwendung erstellt auf Basis der angegebenen Daten die besten Vorschläge für Skigebiete, Unterkünfte, Transport und Gastronomie.Der wohl größte Vorteil dieser Anwendung besteht darin, dass alle Personen in der Gruppe gleichzeitig in einer Anwendung Zugriff auf alle wichtigen Informationen und alle Reservierungen haben. Ein großes Plus ist die Möglichkeit, Meinungen zu äußern und für die Dienste der Anwendung zu werben, was bei der Entwicklung und Auswahl der richtigen Buchungen hilfreich sein kann. Sie können jedoch nicht nur auf die Vorteile achten, wir müssen auch die Nachteile dieser Anwendung besprechen.Einer der großen Nachteile einer bestimmten Anwendung ist der geringe Schutz der Privatsphäre. Wir sind gezwungen, viele Informationen bereitzustellen, um das richtige Angebot für uns zu finden. aus diesem grund wird unsere schutzmission eher klein sein. ausserdem wird die ausführung der handlungen der firma in der schutzmission weniger stark sein. stakeholder sind nicht. hierzu sollte man sich durch fallanalysen oder demetzung der einzelnen stadtgruppen oder stadtbewohner mehr leiten lassen. stakeholder. der erste satzum beispieleschreibt sehr viel über den ethischen konflikt, welcher entsteht, wenn ein solches unternehmengehtimmt nicht liq es eigene. Trotzdem denke ich, dass die Anwendung eine gute Idee hat und ich würde es gerne selbst ausprobieren. 'plattform' würde ich eher als akteur darstellen, sind alles akteure und nicht nur irgendwelche algorithmus. ein value interface kann man zum beispiel durch ein geldfluss zwischen dienstleister und kunden ersetzen. Ich hoffe aufrichtig, dass das Datenschutzproblem verbessert wird. du hast noch einige rechtschreibfehler. hier möchte ich nicht viel kritisieren, vielmehr ist es interessant, dein geschäftsmodell zu testen und zu zeigen, wie das genau. 






",1686057114.0,APPROVED,2023-06-06T12:31:59.861000Z,2023-06-06T13:13:54.695000Z,2023-06-08T09:55:11.354000,2023-06-06T13:13:55.060843Z,2515.0,NOCODE,173.0,"Polish, English, German, Ukrainian",High school diploma/A-levels,23.0,Female,White,Poland,Poland,Poland,Polish,Yes,Full-Time,
41,89.0,G2,"Bezüglich des Alp-Us-Modells war die Geschäftsstruktur gut und gut erklärt. Für einen Beobachter liegen die Hauptvorteile der Nutzung der App in der Zentralisierung von Diensten für den Verbraucher und der Datenerfassung für Unternehmen. Die Vereinfachung des Kundenerlebnisses durch die Bewältigung der wichtigsten Herausforderungen einer Reise, wie Unterkunft, Transport und Verpflegung, ist ein Aspekt, nach dem die meisten Verbraucher suchen. Es ist klar, dass Alp-Us den logistischen Aspekt einer Reise erleichtert. Die zusätzliche Funktion, mehrere Benutzer in einer Gruppe zuzulassen, ist interessant, es müssen jedoch weitere Details bereitgestellt werden, beispielsweise die Nachahmung des interaktiven Aspekts der Planung einer Gruppenreise, beispielsweise die Möglichkeit für Mitglieder, das Datum auszuwählen, an dem sie den Mitgliedern zur Verfügung stehen in der Lage sein, der Gruppe Vorschläge für Orte zu machen. Für die Geschäftsseite gibt es viele Vorteile, wenn eine Plattform wie diese Unternehmen wertvolle Daten liefert. Im Hinblick auf den Gesamtmodus war es ansprechend, der entscheidende Fehler, der im Video gezeigt wurde, war die Konzentration auf die Idee, die Datumsauswahl für einen Gruppenurlaub zu vereinfachen, obwohl es für diese Art von Aufgabe hilfreich ist, die Verfügbarkeit der Skigebiete zu sehen. Der Hauptvorteil für den Verbraucher besteht darin, dass er Zeit spart, wenn er nur auf einer Plattform bucht, anstatt auf vier oder fünf Plattformen wie AirBnb, Tripadvisor und andere zurückzugreifen. Darauf sollten sich zukünftige Marketingkampagnen konzentrieren. Ein weiterer Aspekt, von dem ich erwarten würde, dass er erklärt wird, ist die kommerzielle Seite dieser App, also die Strategie zur Monetarisierung, die für den Zugriff auf einen Geschäftsplan von entscheidender Bedeutung ist.
",1686057122.0,APPROVED,2023-06-06T12:38:32.637000Z,2023-06-06T13:15:04.397000Z,2023-06-08T09:55:11.734000,2023-06-06T13:15:05.548001Z,2192.0,NOCODE,181.0,"Portuguese, Spanish, English, German, Dutch",Undergraduate degree (BA/BSc/other),25.0,Female,White,Portugal,Portugal,Portugal,Portuguese,Yes,Full-Time,
42,60.0,G2,"Der analysierte Geschäftsplan hat viele Stärken: in erster Linie die Möglichkeit, schnell einen ersten Überblick über die Präferenzen der Teilnehmer zu erhalten, anstatt sich in der Nähe zu treffen und Zeit zu verschwenden, um diesen Aspekt der Reise zu diskutieren.
Eine weitere Stärke war die Möglichkeit, auf die üblichen Websites für die Organisation von Reisen zuzugreifen, was mir als Kunde ein gutes Gefühl geben würde.
Gleichzeitig habe ich jedoch den Eindruck, dass die Website nicht unbedingt bequem ist. Die App kann zwar Zeit sparen, ermöglicht aber gleichzeitig nicht die Vermittlung zwischen den Teilnehmern, was bei Gruppenreisen ein wichtiger Aspekt ist.
Außerdem gibt es die Möglichkeit, Angebote einzusehen, wenn sie von den Einrichtungen, Hotels usw., die auf der Plattform sind, zur Verfügung gestellt werden. Ich glaube jedoch, dass die Stärke der App in der Präsenz von günstigen Angeboten und verschiedenen anderen Konventionen liegen könnte. Dies würde selbst diejenigen, die die App nur ungern nutzen, dazu bewegen, sie auszuprobieren.
Wäre ich ein Kunde, würde ich außerdem gerne Zugang zu zusätzlichen Inhalten haben, z. B. zu Informationen über die Geschichte und Geografie des zu besuchenden Ortes. Die Möglichkeit, die Gruppe mit lokalen Führern oder Ausbildern vor Ort zu verbinden, könnte ebenfalls eine gute Idee sein. Auf diese Weise könnten maßgeschneiderte Erlebnisse organisiert werden, ohne dass man sich in einer bestimmten Einrichtung einfinden muss.
Eine weitere Stärke könnte die Möglichkeit sein, die Kosten für bestimmte Aktivitäten (Abendessen in einem Restaurant usw.) in der App selbst zu teilen. Dies würde es ermöglichen, die App nicht nur vor der Reise, sondern auch während der Reise selbst zu nutzen.
Am Ende der Reise könnte die App eine Art Zusammenfassung der Reise und der gemachten Erfahrungen sowie des ausgegebenen Geldes erstellen und ähnliche Erfahrungen an anderen Orten vorschlagen.

Alles in allem sieht der Geschäftsplan bereits sehr interessant aus, und ich denke, dass er viele Menschen ansprechen könnte, vor allem diejenigen, die nicht viel Zeit haben, eine Reise zu planen.

",1686057321.0,APPROVED,2023-06-06T12:39:02.100000Z,2023-06-06T13:23:39.260000Z,2023-06-08T09:55:11.544000,2023-06-06T13:23:39.818032Z,2678.0,C4FP4UXH,201.0,"English, Italian, Spanish, German",Undergraduate degree (BA/BSc/other),23.0,Female,White,Italy,Italy,Italy,Italian,Yes,Part-Time,
43,123.0,G2,"Das Geschäftsmodell scheint mir sehr fortschrittlich und innovativ zu sein. Die Funktion alle Tickets an einer Stelle zu haben ist sehr modern und sorgt für eine Digitalisierung des traditionellen Reisebüros. 
ich finde es gut, dass es einen Planer gibt, welcher den gesamten Planungsaufwand hat, somit wird die Reise für die anderen Gruppenmitglieder vereinfacht. Allerdings besteht hier auch Optimierungspotential. Eine Kommuktion innerhalb der Gruppe oder eine Zustimmung zu der Wahl welche der Planer trifft würden das Erlebnis eventuell noch etwas verbessern. Da momentan die gesamte Verantwortung nur bei einer Person liegt.
Eventuell könnte man die einzelnen Bausteine in der Zukunft weiter separieren, um die App vielleicht auch nur für Einzelheiten zu verwenden, wie einzelne Übernachtungen oder Restaurantinfos. Hier empfiehlt sich eine Verknüpfung mit einem Bewertungssystem wie Google Maps, welche innerhalb der Software anzeigen wie empfehlenswert ein Restaurant ist. 
<span class=""inline-suggestion"">denke die hauptversicherung verfolgt ein hohes potenzial, auch wenn es nur das ist, was man will. was ich auch so sehe, ist dass bei der verbindung von den</span>Aus finanzieller Hinsicht scheint mir hier großes Potential vorzuliegen, da direkte Verhandlungen mit dritten wie bestimmten Hotelketten oder Restaurants gemacht werden können, damit diese aus der Alp up Seite empfohlen und hervorgehoben werden können. Was dem Profit der App helfen kann, ist aber auch eine mögliche Hürde der Vertrauenswürdigkeit. Sollten nur gezielte Hotels und Firmen zur Auswahl stehen, wirkt es möglicherweise abstoßenden auf die Planer, da es sich anfühlen könnte, wie als würden Optionen oder Variablen vor ihnen geheim gehalten. Hier ist also ein hohes Potential, aber auch ein gewissen Risiko in der Verbindung mit den Verbrauchern. 
Das alles in einer App gesammelt wird finde ich sehr gut, dieses Konzept wird sicherlich genug Leute anlocken, die Frage ist jetzt ob das Unternehmen in einer eher kommerzielle und gezielte Richtung geht, oder einen sozialen Weg einschlägt und neben der Gesamtplanung auch als eine Art Reiseführer dient.
",1686058193.0,APPROVED,2023-06-06T13:03:20.310000Z,2023-06-06T13:28:49.348000Z,2023-06-08T09:55:06.743000,2023-06-06T13:28:49.828131Z,1530.0,C4FP4UXH,89.0,"English, German, Spanish",Graduate degree (MA/MSc/MPhil/other),23.0,Male,White,Germany,Germany,Germany,German,No,Full-Time,
